Warum setzt sich ein Falter aus der Familie der Schneckenspinner nachts immer auf schlafende Vögel?;Er setzt sich auf die Vögel, damit er mit seinem Rüssel in das geschlossene Auge des Vogels stecken kann, um dessen Tränenflüssigkeit zu trinken. Damit deckt der Falter seinen täglichen Salzbedarf.;
Warum sieht man auf den Orkney-Inseln in bestimmten Nächten, wie Leute rückwärts den Strand entlanggehen?;In manchen Vollmondnächten herrscht extreme Ebbe. Immer dann sind diese nächtlichen Rückwärtsgänger unterwegs auf der Suche nach einer kulinarischen Spezialität, nämlich der Rasiermessermuschel. (Die Muschel heißt so weil sie die Form eines gebogenen Rasiermessers hat.) Diese Muscheln graben sich im Sand ein und warten auf die Rückkehr des Wassers. Weil sie sehr sensibel auf Erschütterungen reagieren merken sie es, wenn die Rückwärtsgänger den Strand entlang gehen. Um sich in Sicherheit zu bringen fangen sie daher an sich noch tiefer in den Sand einzugraben. Dadurch entsteht eine verräterische Vertiefung im Sand. Die wiederum können die Rückwärtsgeher sehen, weil sie ja sehen was hinter ihnen passiert (würden sie normal nach vorn schauen könnten sie nicht sehen wie sich der Sand hinter ihnen nachdem sie drüber gegangen sind bewegt). An diesen Stellen im Sand graben die muschelsuchenden Rückwärtsgeher die Muscheln dann mit einem stumpfen Messer aus.;
Warum sieht man auf einer kleinen australischen Insel überall ausrangierte Kühlschränke am Straßenrand herumstehen?;Sie werden als Briefkästen verwendet.;
Warum sieht man auf Fehmarn im Sommer Männer mit Rasierschaum-Dosen in der Hand am Strand entlang laufen?;Das sind Rettungsschwimmer die zur Erstversorgung nach Hautverbrennungen durch Quallen Rasierschaum benutzen.;
Warum sieht man bei Reitturnieren immer wieder Springpferde, die eine rote Schleife im Schweif haben?;Pferde die schon einmal stark ausgeschlagen haben, bekommen eine rote Schleife als Warnung für die anderen Reiter.;
Warum sieht man bei vielen Rugby-Turnieren Spieler, die in goldenen Shorts auf dem Platz herumlaufen?;Beim Rugby gilt man ab 35 Jahren als Senioren-Spieler. Es gibt eigene Oldie-Turniere bei denen die Mitglieder aller Mannschaften über 35 sind. Spieler, die in goldenen Shorts rumlaufen, sind über 65 Jahre alt und dürfen nicht angegriffen (z.B. „getackelt“) werden.;
Warum sieht man im englischen Whitchurch jeden Tag Passanten auf Knien herumrutschen?;Ein Geldautomat der britischen HSBC-Bank. Das Gebäude an dem dieser Automat angebracht wurde steht unter Denkmalschutz, deshalb musste der Automat in ca. einen halben Meter Höhe in die Wand eingelassen werden. Fast jeder der dort Geld abheben möchte, muss dazu auf die Knie gehen.;
Warum sieht man im griechischen Isthmia jeden Tag Leute, die Fische von einer Brücke werfen?;Diese Brücke kann, wenn zu große Schiffe durchmüssen, bis zu 12m unter den Wasserspiegel gesenkt werden. Beim anschließenden Anheben der Brücke, bleiben Fische darauf liegen, die die Leute dann wieder ins Wasser zurückwerfen.;
Warum sieht man im portugiesischen Wattenmeer oft Leute mit einem Beutel Salz in der Hand herumlaufen.;Im Wattenmeer lebende Schwertmuscheln graben sich bei Gefahr ein. Fischer streuen Salz in die Löcher. Die Muscheln können das Salz nicht ab- sie kriechen wieder raus. Die Fischer brauchen diese nur noch einzusammeln.;
Warum sieht man in Argentinien überall auf parkenden Autos Plastikflaschen stehen?;Damit erkennt man schon von weitem, dass diese Autos zum Verkauf stehen.;
Warum sieht man in bayerischen Kirchen zuweilen Gläubige auf allen vieren am Boden herumkriechen?;In alten bayerischen Kirchen gibt es noch so genannte Schlupfaltare. Dabei handelt es sich um einen normalen Altar, durch den längs ein Tunnel führt. Früher und teilweiße noch heute war der Glaube verbreitet, dass wenn man durch den Tunnel im Altar krabbelt, seine Krankheit an den Altarwänden abstreift. So kommt es, dass zuweilen Gläubige in der Kirche auf allen vieren am Boden herumkriechen.;
Warum sieht man in Bremen immer wieder Leute, die auf dem Marktplatz auf den Boden spucken?;Gesche Gottfried wurde in 1831 auf dem Marktplatz enthauptet, da sie eine Giftmischerin war. Als Abscheu vor ihren Taten spuckt man heute noch auf den Boden.;
Warum sieht man in der bolivianischen Hauptstadt La Paz regelmäßig Menschen in Zebra-Kostümen?;Damit rücksichtslose Autofahrer anhalten und Leute über den Zebrastreifen und über die Straße ließen, hatte man Menschen in Zebra-Kostümen an die Seite gestellt, die die Autofahrer auf die die Straße überquerenden Personen hinzuweisen.;
Warum sieht man in einem Fußballstadion in Janosovka von der Tribüne aus öfter mal das Spielfeld nicht?;Durch das Stadion fährt ein Zug. Zwischen Tribüne und Spielfeld verläuft ein Gleis, auf dem auch ein Zug fährt, der dann die Sicht auf das Spielfeld versperrt.;
Warum sieht man in einer Klinik auf Helgoland immer wieder Ärzte und Pfleger, die den Patienten absichtlich ein Bein stellen?;Dies sind Ärzte und Pfleger einer Parkinsonklinik. Wenn sie den Patienten ein Bein stellen, wird die Blockade deaktiviert und der Patient kann das Bein heben und danach wieder weitergehen;
Warum sieht man in einer Stadt in Südafrika Autofahrer regelmäßig auf Knien vor ihren Fahrzeugen rumrutschen?;Diese Stadt liegt am Meer und den dort lebenden Pinguinen ist es im Sommer zu heiß, so dass sie sich unter den Autos verkriechen. Autofahrer werden mit Schildern dazu aufgefordert vor der Abfahrt unter dem Auto nachzusehen ob dort Pinguine sind.;
Warum sieht man in Holland Leute an Flussufern stehen, die eine Angel halten, an der ein Holzschuh hängt?;Bei Brücken, die hochgefahren werden, oder auch bei Schleusen, hält der Brückenwärter eine Angel, an der ein Holzschuh hängt, damit der Kapitän des Schiffes, das die Brücke oder Schleuse gerade passiert, die Durchfahrtsgebühr in den Holzschuh werfen kann, 0,50 € - 2,00 €.;
Warum sieht man in manchen belgischen Kneipen Gäste herumstehen, die nur einen Schuh anhaben?;Gäste, die ein spezielles Bier samt Halterung bestellen, müssen einen Schuh als Pfand hergeben, damit sie dieses Bierglas nicht stehlen. Dieses Bierglas samt Halterung wurde früher von Kutschern bestellt, die damit auch draußen auf der Kutsche trinken konnten. (Auf dem Kutschbock gab es keine Halterung für das Bierglas, deshalb wurde eine eigene Halterung konstruiert, die mit dem Bierglas mitgegeben wurde). Später bestellten auch andere Gäste diese Bier und oft kam es vor, dass die Gläser samt Halterung gestohlen wurden. Seitdem wird jedem Gast, der dieses Bier bestellt als Pfand einen Schuh abgeben.;
Warum sieht man in manchen belgischen Kneipen Gäste herumstehen, die nur einen Schuh anhaben?;Gäste, die ein spezielles Bier samt Halterung bestellen, müssen einen Schuh als Pfand hergeben, damit sie dieses Bierglas nicht stehlen. Dieses Bierglas samt Halterung wurde früher von Kutschern bestellt, die  damit auch draußen auf der Kutsche trinken konnten. (Auf dem Kutschbock gab es keine Halterung für das Bierglas, deshalb wurde eine eigene Halterung konstruiert, die mit dem Bierglas mitgegeben wurde). Später bestellten auch andere Gäste diese Bier und oft kam es vor, dass die Gläser samt Halterung gestohlen wurden. Seitdem wird jedem Gast, der dieses Bier bestellt als Pfand einen Schuh abgeben. ;
Warum sieht man in Renningen die Kunden eines Optikers oft im Schaufenster des Brillenladens stehen?;Der Optiker hat das Plakat mit den Buchstaben (zum Sehtest) am Baum an der gegenüberliegenden Straßenseite befestigt. Die Kunden, die einen Sehtest machen, stehen deshalb im Schaufenster.;
Warum sieht man in Schweden an den Türrahmen von immer mehr Geschäften rote, grüne und gelbe Striche?;Die Striche sind immer in folgenden Höhen angebracht: grün 160 bis 170cm, gelb 170 bis 180cm und rot 180 bis 190cm. Diese Markierungen sollen es den Zeugen von Raubüberfällen einfacher machen die Größe von Tätern anzugeben.;
Warum sind 50 Sessel in einem Kino in Bad Homburg mit Plastik überzogen?;(das Kino hat 130 Sitze- 50 davon sind mit Kunststoff überzogen) Das Kino befindet sich im Komplex der Bad Homburger Taunustherme. 50 Sessel der 130 Sessel sind mit einer Glasscheibe von den anderen getrennt und befinden sich im Wellnessbereich. Diese 50 Sessel können mit Bademantel und Badesachen benutzt werden, daher sind sie mit Plastik überzogen. Die restlichen 80 Sitze werden wie in einem normalen Kino benutzt.;
Warum sind am Stephansdom in Wien 8 Hirschgeweihe am Turm angebracht?;Die Hirschgeweihe waren Blitzableiter. Weil man bis dahin noch nie einen Hirsch gesehen hatte, der vom Blitz getroffen wurde, dachte man, dass diese Geweihe helfen.;
Warum sind auf dem Einwickelpapier der Hamburger von „Burger King“ die Ziffern 1 bis 12 aufgedruckt?;Die Zahlen sind für 5-Minutenschritte der Stunde. Beim Einwickeln wird jeweils die entsprechende Zahl angekreuzt. Die eins entspricht dabei fünf Minuten nach, die fünf  25 Minuten nach- die zwölf Punkt usw. So können die Mitarbeiter immer sehen, wie alt ein Hamburger ist – wenn er älter als 10 Minuten ist wird er im Regelfall nicht mehr verkauft.;
Warum sind auf einer österreichischen Autobahn weiße Halbkreise auf dem Seitenstreifen aufgemalt?;(A2 zwischen Klagenfurt und Völkermarkt) Diese Halbkreise sind Nebelwarnpunkte und sind im Abstand von 33 m aufgemalt. Erkennt der Autofahrer noch zwei der Halbkreise, so empfiehlt man eine Höchstgeschwindigkeit von 60 km/h. Sieht er nur noch einen Halbkreis auf Grund des dichten Nebels, sollte er unter 40 km/h bleiben. Auf dieser Strecke ist sehr oft Nebel.;
Warum sind auf vielen Giebeln alter Fachwerkhäuser Metallkugeln befestigt?;Fachwerkhäuser brennen sehr leicht und da das früher oft vorkam wurden Wertgegenstände (Urkunden, Verträge, Schmuck, etc) in diesen Metallkugeln aufbewahrt, sodass diese einen Brand überstehen;
Warum sind auf zahlreichen Wiener Kanaldeckeln Plaketten montiert, auf denen ein Krebs zu sehen ist?;Die Plakette bedeutet, dass kein Schmutzwasser in die darunter liegende Kanalisation gelangen soll. Denn dieses Rohrsystem leitet Regenwasser nicht in eine Kläranlage sondern direkt in einen Bach. (Der Krebs wurde als Symbol genommen, weil er in sauberem Wasser lebt);
Warum sind Blumenwanzen-Männchen bisexuell?;Weil Blumenwanzenmännchen permanent Sex haben wollen. Wenn kein Weibchen da ist, nehmen sie ein Männchen (über den Blutkreislauf gelangt das Ejakulat in die Hoden des anderen Männchens und vermischt sich mit dessen Sperma - so gelangt es über einen Zwischenträger möglicherweise trotzdem zum Ei eines Weibchens ohne, dass die Beteiligten miteinander Sex hatten).;
Warum sind die 1300 Bewohner von Helgoland zur Zeit gezwungen, öfter einen Kurzurlaub zu nehmen?;Weil der einzige Zahnarzt in Rente gegangen ist- einen Nachfolger gibt es nicht, weil dort keine Wohnung frei ist.;
Warum sind die beiden Eingangstüren des Audienzsaales im Lübecker Rathaus unterschiedlich hoch?;In diesem Audienzsaal wurde früher Recht gesprochen: Wenn man unschuldig war, durfte man mit erhobenem Haupt durch die höhere Tür gehen. Wenn man schuldig war, musste man gebückt durch die niedrige Tür gehen.;
Warum sind die DVDs der weltbekannten TV-Serie „Unsere kleine Farm“ in Finnland erst ab 18 Jahren freigegeben?;In Finnland sind von vornherein ALLE DVDs erst ab 18 Jahren freigegeben. (Wenn eine Produktionsfirma möchte, dass ihre DVD für Jüngere freigeben wird, kann sie das beantragen. Doch das kostet Geld. Und bei 200 Folgen von „Unsere kleine Farm“ hat Universal darauf verzichtet.);
Warum sind die Japaner von heute durchschnittlich 10cm größer, als die Japaner von vor 20 Jahren.;Wegen des Übergangs vom Knien zum Sitzen auf Stühlen;
Warum sind die Kostüme vieler Hexen von schwäbischen Fastnachtsgruppen nummeriert?;Damit die „Hexen“ bei Verbrechen nicht anonym bleiben, sondern identifiziert werden können (sonst müsste der Fastnachtsverein die entstandenen Schäden bezahlen);
Warum sind die Laternengläser einer Promenade auf Kreta auf einer Seite mit grüner Farbe angestrichen?;An dem Strand an dieser Promenade (auf der Seite sind die angestrichenen Laternengläser) vergräbt eine seltene Meeresschildkröte ihre Eier. Die geschlüpften Jungen machen sich nachts auf dem Weg zum Meer. Dabei orientieren sie sich an den Spiegelbildern der Sterne und des Monds auf der Wasseroberfläche. Damit sie diese erkennen können und nicht abgelenkt werden, sind die Laternengläser auf der Seite des Strands durch die grüne Farbe verdunkelt;
Warum sind die Nutzer eines öffentlichen Parkplatzes in Schwetzingen oftmals im ersten Moment verwundert?;Der Karlsruher Künstler Jens Andres hat 2008 an einem Wettbewerb in Schwetzingen teilgenommen. Der Wettbewerb vom Schwetzinger Kunstverein hieß „Im Wege stehend“. Der Künstler machte etwas, was die Stadt bis heute nicht entfernt hat. Er hat auf dem Parkplatz zwei Parkplätze für Ufos reserviert, indem er in blau und weiß gehaltene Symbole zweier Ufos auf die Parkplätze aufbrachte.;
Warum sind die Schalensitze in der LTU-Arena in Düsseldorf verschiedenfarbig und bunt durcheinander angeordnet?;Die Arena sieht bei einem Kameraschwenk durch die bunten Sitze voll aus, auch wenn das Stadion nicht ausverkauft ist.;
Warum sind die Südtiroler Apfelbaum-Plantagen flächendeckend mt Sprinkler-Anlagen ausgerüstet?;Es schützt die Äpfel vor Frostschäden. Apfelblüten reagieren sehr empfindlich auf Spätfrost. Droht der Einbruch von Frost, wird die Sprinkler-Anlage eingeschaltet. Es bildet sich um die Blüte eine Eis-Hülle unter der es nie kälter als –0,5 Grad wird.;
Warum sind ganz normale Radfahrer im norwegischen Trondheim für viele Touristen ein begehrtes Fotomotiv?;(25.000 Studenten gibt es in Trondheim, die sich innerstädtisch und auf dem Weg zur Uni meist mit dem Fahrrad fortbewegen) In Trondheim gibt es einen 130 m langen Weg, der eine 20 %-ige Steigung hat. Der Weg geht von der Innenstadt bis zur Uni. An diesem Weg gibt es den weltweit einzigen Fahrradlift. Es handelt sich um eine Metallschiene, am Rand des Bürgersteiges. Der Fahrradfahrer stellt sein rechtes Bein auf die Schiene und wird so nach oben gezogen, während er auf dem Fahrrad sitzt. Mit einer Plastikkarte, die man für eine jährliche Gebühr von 12 € bekommt, wird der Fahrradlift in Betrieb gesetzt.;
Warum sind im russischen Losevo ein Mal im Jahr viele Männer mit aufblasbaren Sexpuppen unterwegs?;(Seit 2003 treffen sich in Losevo, nördlich von St. Petersburg, 200 Männer). Die Männer stürmen auf Kommando in einen reissenden Wildwasserfluss und müssen eine 600 m lange Strecke mit vielen Stromschnellen hinter sich bringen. Dabei muss jeder eine Puppe mitnehmen. Wer als Erster mit Puppe ins Ziel kommt, hat gewonnen.;
Warum sind in Bangkok ca. 150 Polizisten ständig mit einem Sauerstofftank unterwegs?;Wegen den vielen Staus in Bangkok kommt es häufiger zu Geburten in Autos. Diese Polizisten sind ausgebildete Geburtshelfer und zu ihrer Ausrüstung gehört der Sauerstofftank.;
Warum sind in den USA riesige Pfeile im ganzen Land verstreut?;Sie dienen als Wegweiser für die Flugroute New York - San Fransisco.;
Warum sind in der Maximilianstraße in Berlin-Lichtenberg nachts viele Fenster blau beleuchtet?;Die Wohnungen, deren Fenster blau beleuchtet werden, stehen gerade leer und sind zu vermieten.;
Warum sind in einem Ortsteil von Fort Myers in Florida alle Verkehrszeichen nur maximal 61 cm hoch?;"In diesem Ortsteil gibt es ca. 50 Häuser von denen jedes eine Garage für ein Flugzeug hat. Um zur Startbahn des Flugplatzes zu kommen fahren die Besitzer mit ihren Flugzeugen auf den öffentlichen Straßen. Damit die Flügel der Flugzeuge nicht alle Straßenschilder ""abräumen"", sind die Schilder so niedrig, dass die Flügel noch darüber passen.";
Warum sind in Erfurt an einigen Gebäuden der Altstadt links und rechts über den Hauseingängen runde Löcher?;Wohlhabende Erfurter Bürger hatten ein Biereigenrecht und durften Bier selber brauen. Als Zeichen für frisch gebrautes Bier wurde Gerstenstroh in die Löcher gesteckt.;
Warum sind in Gambia Fahrräder in der Nähe von Wahllokalen verboten?;In Gambia wird mit Kugeln gewählt (nicht mit Wahlscheinen). Diese Kugeln werden in farblich gekennzeichnete Behälter geworfen. In den Wahlurnen ist ein Glöckchen, das immer dann klingelt, wenn eine Kugel hineinfällt. Dann weiß der Wahlhelfer, dass gewählt wurde. Damit es durch Fahrradklingeln keine Verwirrungen gibt, sind Fahrräder in der Nähe verboten.;
Warum sind in Japan fast alle Handys wasserdicht?;In Japan ist es wichtiger, dass das Handy wasserdicht ist, als dass es einen austauschbaren Akku hat. Der Grund ist, dass japanische Frauen so sehr auf ihr Smartphone fixiert sind, dass viele von ihnen das Gerät sogar mit unter die Dusche nehmen. Viele Hersteller haben dieses Bedürfnis erkannt und bringen daher wasserdichte Modelle heraus.;
Warum sind in Schleswig-Holstein Beamte damit beschäftigt, Kothäufchen zu zählen?;Es ist der Kot von Ringelgänsen (unter Artenschutz), die vor ihrem Flug in die arktischen Brutgebiete auf den Halligen (Nationalpark) Rast machen. Die Wiesen der Halligen werden flächendeckend abgegrast und verkotet. Damit die Bauern die Gänse nicht abschießen, wird der Kot pro Quadratmeter gezählt und hochgerechnet um daraus eine Entschädigung für die Bauern zu berechnen.;
Warum sind in Schweden an Wochenenden sehr viele Menschen mit grünen Plastiktüten unterwegs?;Alkohol über 3,5 Promille darf in Schweden nur in bestimmten Läden verkauft werden. Dieser Alkohol wird in grüne Tüten verpackt, weil in Schweden Grün die Farbe der Diskretion ist.;
Warum sind in Venedig alle Gondeln schwarz?;Ursprünglich gab es Gondeln in allen möglichen Farben. Im Jahre 1562 wurde dann in Venedig das sogenannte „Aufwandgesetz“ erlassen. Dadurch sollte der ausufernden Prunksucht Einhalt geboten werden. Seitdem durften Gondeln nur noch schwarz gestrichen werden – und so ist es bis heute geblieben.;
Warum sind Kanaldeckel immer rund?;Weil runde Deckel nicht in den Schacht fallen können.;
Warum sind rund 20 Tonnen Nüsse schuld daran, dass 2007 eine TV-Serie in den USA vor der Absetzung gerettet wurde?;(Die Serie hieß Jericho und spielte in einer amerikanischen Kleinstadt nach einem Atomangriff) Die erste Staffel dieser Serie war kein großer Erfolg deshalb beschloss der Sender CBS sie abzusetzen. Das letzte Wort in der letzten Folge der Staffel war „nuts“, aber nicht mit der Bedeutung „Nüsse“ sondern mit der Bedeutung „verrückt“, „durchgedreht“. Daraufhin schickten Fans der Serie aus Protest gegen die Absetzung (nach Aufrufen im Internet) Nüsse an den Sender. Insgesamt bekam der Sender 20 Tonnen Nüsse und setzte die Serie fort, verbunden mit einem Aufruf an die Fans keine Nüsse mehr zu schicken. Nach der siebten Folge der zweiten Staffel wurde die Serie dann aber endgültig abgesetzt.;
Warum sind sehr viele Häuserecken in der Altstadt Kopenhagens abgeschrägt?;Nach einem Großbrand in der Altstadt, bei dem die Feuerwehrwagen schlecht um die Ecken kamen, mussten 1796 alle Ecken abgeschrägt werden.;
Warum sind Straßenräuber mit schuld daran, dass die Produktion des VW-Käfers in Mexiko eingestellt wurde?;Sie überfielen meistens diese Autos, da der hinten sitzende Fahrgast nicht fliehen konnte. Deshalb beschloss die Regierung, dass Taxis vier (statt 2) Türen haben müssen. Früher waren fast alle Taxis Käfer, doch da nun alle Taxifahrer keine Käfer mehr kauften, wurde die Produktion eingestellt.;
Warum sind Stuten selber schuld, dass mit ihrem Schweifhaar keine Geigenbögen bespannt werden?;Durch den ständigen Kontakt mit dem Urin sind die Schweifhaare nicht so stabil wie die der Hengste.;
Warum sind Waschmaschinen in China rosa und nicht weiß?;Waschmaschinen werden in China meist zu Hochzeiten verschenkt und weiß ist in China die Farbe der Trauer.;
Warum sitzen die Bewohner eines Schwesternheimes in Berlin im Winter regelmäßig für 10 Minuten im Dunkeln?;Das Schwesternheim gehört zu einer Klinik. Am ersten Mittwoch im Monat wird um ca. 20 Uhr im gesamten Gebäudekomplex der Notstromaggregat getestet. Dazu werden die Gebäude für 10 Minuten vom Netz genommen und das Notstromaggregat schaltet sich ein. Da das Schwesternheim dabei nicht mit Strom versorgt wird, ist es im Winter daher für 10 Minuten einmal im Monat dunkel.;
Warum sitzen in Emmerich seit März 2004 drei Männer in einer Bude an einer Straße und warten, dass das Telefon klingelt?;Diese Bude ist an einer Bahnstrecke, deren Schranken seit einigen Jahren kaputt sind. Durch das Telefonklingeln wird ein Zug angekündigt. Zwei der drei Männer sperren mit einem rot-weißen Band die Bahnstrecke von Hand ab. Der Dritte überwacht den Vorgang. Die Schranken sind aus den 60er Jahren und zu alt, um sie zu reparieren. (Das Genehmigungsverfahren für neue Schranken dauert voraussichtlich bis Mai 2005 an... - Bisher sind ca. 1 Mio. Euro an Personalkosten ausgegeben worden);
Warum sitzt bei jeder Ausgabe von „Wer wird Millionär?“ ein Mann im Studio, der die ganze Zeit Zeitung liest?;Sein Name ist Wolfgang Jäger und er muss, wenn die Millionenfrage richtig beantwortet wurde, einen Knopf drücken, damit ein Feuerwerk losgeht- er ist seit Anfang dabei und weil er selten seine Aufgabe erfüllen muss, liest er Zeitung.;
Warum sitzt der Flugkapitän im Cockpit immer auf der linken Seite?;In den Anfängen der Fliegerei orientierte man sich an natürlichen oder künstlichen Linien, wie Küsten und Straßen. Beim Fliegen gab es die Absprache, jeweils rechts von diesen Linien zu fliegen, um Zusammenstöße zu vermeiden. Als später Flugzeuge mit 2 Sitzen im Cockpit aufkamen, war die linke Seite wegen der besseren Sicht auf diese Linien dem Kapitän vorbehalten.;
Warum sitzt einmal im Jahr ein Kapuzineräffchen am Redaktionstisch der „Chicago Sun-Times“?;Seit 2003 markiert dieser Affe zu Beginn jeden Jahres mit einem Stift einige Aktien auf den Börsenseiten des Wallstreet-Journals. Mit seinen Vorhersagen welche Aktien im nächsten Jahr erfolgreich sein werden hat der Affe seit 2003 den Dow-Jones-Index viermal geschlagen. Mit dieser Aktion will die Zeitung ihre Leser dazu animieren in Aktien zu investieren (wenn selbst ein Affe mit Aktien Gewinn machen kann, können Leute die wenig Ahnung vom Aktiengeschäft haben das auch);
Warum sollte unter Ronald Reagan per Gesetz Ketchup zu Gemüse erklärt werden?;Reagan wollte im Sozialbereich sparen. 1981 wurde versucht Ketchup zu Gemüse erklären, um bei der Schulspeisung für Kinder zu Sparen. Laut Gesetz muss täglich Gemüse auf den Teller der Kinder.;
Warum sorgte die Ernte einer Möhre bei einer 84-jährigen Witwe aus Kanada im August 2017 für Begeisterung?;Die Witwe hatte 13 Jahre zuvor ihren Verlobungsring verloren. Der Ring war im August 2017 wieder aufgetaucht und zwar war die Möhre durch den Ring gewachsen.;
Warum sorgte ein Geldschein der Seycheller für einen Skandal?;"Palmblätter hinter dem Portrait der Queen formten das Wort ""Sex"".";
Warum spannt die Hakennasennatter regelmäßig ihre Gaumenmuskeln so lange an, bis sie anfängt aus dem Maul zu bluten?;Sie stellt sich tot, um sich vor Fressfeinden (die kein Aas fressen) zu schützen.;
Warum spendet der Schweizer Nationalspieler Alex Frei dem Basler Zoo seit der EM 2004 jedes Jahr 700 Franken?;2004 wurde Alexander Frei wegen grober Unsportlichkeit von der EM ausgeschlossen: Er hatte im Spiel Schweiz gegen England seinen Gegenspieler Steven Gerrard angespuckt (als Revanche für ein vorangegangenes Foul des Engländers). Als Wiedergutmachung übernahm er kurz darauf eine Tierpatenschaft für ein Lama des Basler Zoos (diese Tierpatenschaft kostet 700 Franken pro Jahr);
Warum spendierte „Manchester United“ einer Kirche in England Geld für zwei neue Fenster?;(Die Kirche heißt St. Francis und steht in Dudley) Auf diesen zwei Fenstern ist der 21-jährige englische Fußballspieler Duncan Edwards zu sehen. Er kam 1958 mit sieben Kameraden seiner Fußballmannschaft „Manchester United“ in einem Flugzeugcrash ums Leben. Die Trauerfeier fand in seiner Heimatstadt Dudley statt. Da Duncan Edwards damals als der größte Fußballspieler galt, spendierte der Fußballverein „Manchester United“ 1961 zwei Fenster für die Kirche in seiner Heimatstadt. Duncan Edwards ist auf einem Fenster in den Farben von „Manchester United“ und auf dem anderen Fenster in den Farben der englischen Nationalmannschaft zu sehen.;
Warum spielt ein Werfer der amerikanischen Baseball-Liga mit einem Handschuh, der sechs Finger hat?;Der Baseballspieler Pat Vendetti tauscht während des Spieles die Wurfhand. Er spielt also beidhändig. Dazu tauscht er natürlich auch den Handschuh. Der Handschuh kann sowohl an der linken und der rechten Hand getragen werden. Dieser Handschuh hat vier normale Finger und zwei Daumen, jeweils links und rechts von den vier anderen Fingern.;
Warum sponsert die Hauptniederlassung von Daimler-Chrysler in Sindelfingen zwei Privatpiloten und deren Cessnas?;Wenn z.B. Hagel droht, fliegen die beiden hoch und impfen die Wolken mit Silberjodit. Diese Chemikalie unterbindet die Bildung von Hagelkörnern. Dadurch werden die vielen Neuwagen auf dem Betriebsgelände vor schweren Lackschäden bewahrt.;
Warum sprangen 1966 während einer NATO-Konferenz in Bonn alle Beteiligten von ihren Sitzen auf und rannten ans Fenster?;Ein weißer Wal hatte bei der Nordseemündung des Rheins falsch abgebogen und schwamm den Rhein entlang;
Warum spricht man eigentlich von Schmiergeld;Bei einer Kutschenfahrt bezahlte man fast alles- wenn man aber schneller fahren wollte, bezahlte man dem Kutscher Geld fürs Räderschmieren → Schmiergeld;
