 Was ist der so genannte „Hawaii-Typ“?;Ein Vulkantyp (auch Schildvulkan genannt) der besonders für Vulkane auf Hawaii typisch ist.;
„Adventswasser“ - was ist das ?;„Adventswasser“ ist ein Begriff aus der Binnenschifffahrt. Regen im November und der erste Schnee im Dezember führen dazu, dass die Flusspegel ansteigen. Dieses Hochwasser in der Adventszeit wird „Adventswasser“ genannt.;
„Bestätigungsverkehr“ – was ist das?;„Verkehr“ ist im Amateurfunk die Beförderung von Nachrichten per Funk. Wenn ein Funker die Nachricht eines anderen hört und bestätigt, dass die Nachricht gehört wurde, ist das der Bestätigungsverkehr.;
„Bonner Advent“ – was ist das?;Eine Kohlsorte, die im Gegensatz zu anderen Sorten nicht schon im Oktober, sondern erst Anfang Dezember in der Gegend um Bonn ausgepflanzt wird.;
„Bürstenlose Erregung“ – was ist das?;Kohlebürsten sind Bestandteil von Elektromotoren – über sie kommt der Strom in den Motor. Wenn der Strom fließt, heißt das Erregung. Wenn der Strom statt über Bürsten über eine Spule in den Motor gelangt, heißt das bürstenlose Erregung (ist zum Beispiel geräuschärmer).;
„Flüssige Intelligenz“ - was ist das?;In der Psychologie unterscheidet man „kristallisierte Intelligenz“ und „flüssige Intelligenz“. „Kristallisierte Intelligenz“ ist alles, was als Bildung gespeichert ist, das Wissen, das abrufbar ist und sich schon kristallisiert hat, also fester Bestandteil des Gehirns ist. „Flüssige Intelligenz“ ist die Fähigkeit, was immer in „Genial daneben“ gemacht wird. Also um an Wissen, das man noch nicht besitzt, zu gelangen. Nur durch (mehr oder weniger) logisches Denken an das Wissen zu gelangen. Das Denken ist also noch „im Fluss“, hat sich noch nicht kristallisiert, daher heißt es „flüssige Intelligenz“.;
„Gelegenheitsverkehr“ – was ist das?;Die Beförderung von Personen mit Kraftfahrzeugen, die nicht in einen Linienverkehr fallen, sondern zu bestimmten Gelegenheiten gebucht werden können.;
„Gummifluss“ - was ist das?;Wenn z. B. bei Kirschbäumen die Rinde auf Grund Krankheit oder Ungeziefer geöffnet und somit beschädigt wird, tritt an dieser Stelle eine gummiartige Flüssigkeit aus, um diese Stelle zu schützen. Das nennt man den „Gummifluss“.;
„Gummifluss“ – was ist das?;Wenn bei einem Baum die Rinde verletzt wird, tritt eine gummiartige Flüssigkeit aus- die heißt auch Gummifluss.;
„Hausfrauenschnitt“ - was ist das?;Großküchen bestellen Kartoffeln geschält und in Vakuum verpackt. Es gibt sie zum Beispiel in Scheiben oder gewürfelt- Wenn sie geviertelt sind, ist dass der Hausfrauenschnitt.;
„Haus-zu-Haus“-Verkehr - was ist das?;Der „Haus-zu-Haus“-Verkehr ist in § 21 a der Straßenverkehrsordnung geregelt. Grundsätzlich muss man sich im Auto immer anschnallen, egal wie kurz die Strecke ist. Ausnahme gibt es für Autos, die im Minutentakt anhalten und von Haus zu Haus fahren, z. B. Post, UPS. Dann muss man sich nicht anschnallen, weil es sich um „Haus-zu-Haus“-Verkehr handelt.;
„Mitnehmen oder hier essen?“ Warum müssen McDonalds & Co. jedem Kunden diese Frage stellen?;Wegen der Mehrwertsteuer: Mitnehmen: 7%, Im Restaurant essen: 16%;
„Rammelwolle“ – was ist das?;Das Fell, das die Rammler (männliche Feldhasen) verlieren, wenn sie während der Paarungszeit gegeneinander um Weibchen kämpfen.;
„Saisonaler Hodenabstieg“ - was ist das?;Der Feldhamster ist ein Tier, das Winterschlaf hält. Während des Winterschlafs ziehen sich seine Hoden in die Bauchhöhle zurück, da während des Winterschlafs somit keine Energie für Samenproduktion verwendet werden muss. Kurz vor dem Aufwachen beginnt die Samenproduktion wieder und die Hoden wandern nach unten zurück und der Feldhamster ist wieder zeugungsfähig. Da die Hoden für die Paarungssaison nach unten absteigen, nennt man das den „saisonalen Hodenabstieg“.;
„Schwanzatmung“ - was ist das?;Wenn ein Vogel Atemwegserkrankungen hat, erkennt das der Veterinär daran, dass beim Atmen nicht nur der Brustbereich sich bewegt, sondern auch der Bauchraum und der Schwanz. Das nennt der Tierarzt dann „Schwanzatmung“.;
„Stressaufnahme“ – was ist das?;Eine bestimmte Röntgenaufnahme, bei der Körperteile unter Stress gesetzt werden müssen (mit Schienen), um sie röntgen zu können (z.B. Bänder).;
„Trockenstress“ – was ist das?;Bei Hitze- und Wassermangel zeigen Pflanzen Stresssymptome, z. B. ausbleibenden Wachstum. Diesen Zustand nennt man „Trockenstress“.;
„Vogeldunst“ – was ist das?;In Italien und Spanien werden Singvögel geschossen (gejagt). Die Munition ist millimeter-feiner Schrot, der wie ein Dunstschleier durch die Luft fliegt. Deshalb heißt diese Munition „Vogeldunst“.;
„Wolftöter“ - was ist das?;„Wolftöter“ ist ein Metallstück, das an einer Geige befestigt wird und für einen klaren Ton sorgt. Wird ein Ton gespielt, schwingen die Saite und der Holzkörper und es kann sein, dass der Ton verzerrt wird und es sich wie Wolfgeheule anhört. Geigenspieler wissen, bei welchem Ton oder welchen Tönen das bei ihrer Geige der Fall ist. Damit der Ton nicht jault, wird der „Wolftöter“ unter der Saite befestigt.;
„Zwergenwein“ - was ist das?;Bei alten und ausgetrockneten Fliegenpilzen biegt sich der Kopf am Rand nach oben, sodass auf dem Fliegenpilz eine Art Auffangbecken entsteht. In diesem Auffangbecken sammelt sich Regenwasser, das mit der Zeit die Giftstoffe des Fliegenpilzes aufnimmt. Diese giftige Flüssigkeit nennt der Pilzsammler „Zwergenwein“, da in Märchen solche Zaubertränke und auch Zwerge eine Rolle spielen.;
1656 ließ der Magdeburger Bürgermeister 16 Pferde in entgegengesetzter Richtung an einer Kugel ziehen. Warum?;Experiment: Die beiden Kugelhälften wurden fast leer gepumpt. Durch das entstandene Vakuum hielt die Kugel zusammen und konnte auch von den Pferden nicht auseinandergerissen werden.;
Aus welchem Grund droht Kühen in der Südost-Türkei ein Gefängnisaufenthalt?;Wenn sie Straßen verschmutzen. (Es gibt dort ein ausgedientes Gefängnis, das von der Polizei zu diesem Zweck benutz wird);
Aus welchem Grund war der British-Sansibarische Krieg 1896 besonders?;Er war mit 38 Minuten der kürzeste Krieg der Weltgeschichte.;
Begrüßungsschmerz – was ist das?;Der Arzt diagnostiziert Rheuma, wenn ein Patient bei einem bestimmten Handdruck (zur Begrüßung) diesen Schmerz verspürt.;
Brettgeld - was ist das?;Wenn Papiergeld beschädigt ist, tauscht man es bei der Deutschen Bank. Dort wird der Schein auf ein Holzbrett gelegt und dort zusammengepuzzelt. Sind über 50 % des Scheins noch da, wird er gegen einen neuen ausgetauscht. Dieses Geld nennt man Brettgeld.;
Büchsenlicht – was ist das?;Wenn das natürliche Licht ausreicht um das Wild durch das Zieloptik der „Büchse“ noch zu sehen spricht der Jäger von Büchsenlicht.;
Buckelzählen - was ist das?;In der Sprache der Zauberer nennt man das Kartenlegen „zählen“. Soll ein Zuschauer eine Karte ziehen und der Zauberer macht so, als ob er die Karte mit in den Kartenstapel mischen würde, in Wahrheit aber versteckt er die Karte in der Hand, wird das als „buckeln“ bezeichnet. Wird dieser Trick beim Kartenlegen angewandt, nennt man das Buckelzählen.;
Dreischenkelerziehung – was ist das?;Die Beeinflussung des Wuchses einer Weinrebe heißt „Erziehung“. Bei einer Dreischenkelerziehung verzweigt sich der Rebstamm in drei Äste (beziehungsweise Schenkel).;
Ein Fußballtorwart hat 2004 sein Trikot in die Fankurve geworfen und sich hinterher schwarz geärgert. Warum?;Er hat sich beim Werfen den Arm ausgekugelt und fiel zwei Wochen aus.;
Erfrischungsgeld – was ist das?;Wahlhelfer sind ehrenamtlich tätig und bekommen für ihre Arbeit eine Aufwandsentschädigung von 21 Euro die für Imbiss und Getränke reichen soll. Diese Entschädigung heißt deshalb „Erfrischungsgeld“.;
Für welche Straftat sind Millionen von Amerikanern der Näherin Rosa Parks dankbar?;Die Afro-Amerikanerin hat sich am 1.12.1955 in einem Bus in Alabama auf einen Platz für Weiße gesetzt. Weil sie müde war, weigerte sie sich für einen Weißen aufzustehen. Daraufhin gab es eine 381-tägige Protestserie. Die Rassentrennung wurde danach großteils abgeschafft.;
Fußluft – was ist das?;Türen die nicht bis ganz nach unten gehen. (bei öffentlichen Toiletten, Umkleidekabinen usw.);
Im 19. Jhd. trugen Mädchen manchmal beim Tanzen einen Apfelschnitz in ihrer Achselhöhle. Warum?;Wenn ein Mädchen, damals in Österreich, die Liebe eines Jungen vermutete, dann steckte sie sich beim Tanzen einen Apfelschnitz in ihre Achselhöhle. Der verschwitzte Apfelschnitz wurde dem Jungen angeboten. Hat dieser den Apfel gegessen, hat er somit seine Gefühle erwidert und das Mädchen war sich seiner Liebe sicher.;
Im Februar 2004 hat ein englischer Pfarrer 275 Gewehrpatronen gesegnet. Warum?;Die Witwe eines Waffenspezialisten hatte dessen Asche in Patronen füllen lassen. Diese wurden gesegnet, bevor seine Freunde mit den Patronen auf eine Jagd gingen.;
Im Jahr 2004 geriet ein Partyschiff auf dem Lake Travis in Texas in Schräglage und kippte um. Warum?;Alle Passagiere wollten einen Blick auf einen FKK-Strand erhaschen.;
In Lübeck gibt es eine Straße, die „Tittentastergang“ heißt. Wie kam die Straße zu ihrem Namen?;Im Mittelalter stillten reiche Frauen ihre Kinder nicht selbst, sondern schickten Prüfer in diese Straße, die dort eine Amme zum Stillen aussuchten.;
"In welchem Bereich machte ""Luise die Wildsau"" Karriere?";"War Spürwildschwein für Drogen bei einer Hundestaffel. Ihr angeborenes Talent als ""Trüffelschwein"" hat Louise auf diese Weise in den Dienst der Öffentlichkeit gestellt. Sie war bei der Polizei (in Lüneburg, wenn ich mich recht erinnere) einer Hundestaffel angegliedert, weil man wohl verhindern wollte, dass sie dem Polizeipräsidenten direkt unterstellt würde. Louise wurde übrigens im Sendebereich der ARD berühmt, als sie eine tragende Rolle in dem 200sten Tatort übernahm, und zwar an der Seite von Kommissarin Inge Meysel.";
In welchen Ehrenkreis wurden George Washington und Abraham Lincoln 1992 aufgenommen?;In die Ruhmeshalle der amerikanischen Wrestling Vereinigung.;
Kaltauszug – was ist das?;Es gibt Kräuter (z.B. Leinsamen) die nur mit kaltem Wasser übergossen werden sollen, damit deren Wirkstoffe nicht zerstört werden. Dieses kalte Wasser zieht die Inhaltsstoffe aus dem Wasser raus, deshalb – Kaltauszug;
Lichtgeschmack – was ist das?;Manche Lebensmittel reagieren auf Lichteinfall (Sonnenlicht oder auch Kunstlicht) mit einer Geschmacksveränderung. Vor allem Milch und Bier (deshalb werden getönte Flaschen verwendet).;
Mit welchem alltäglichen Gegenstand kann man ein Flugzeug schrottreif machen?;Flugzeuge bestehen zu einem Großteil aus Aluminium. Wenn jemand ein Fieberthermometer ausschüttet bildet das Quecksilber mit dem Aluminium ein Amalgam, das sich ähnlich we Holzfäuleausbreitet und das Aluminium zerstört.;
Mit welchem außergewöhnlichen Zahlungsmittel wurden im 14. Jahrhundert Pachtzinsen gezahlt?;Im Mittelalter wurde vor Ostern mit Eiern bezahlt. Denn in der Fastenzeit waren Eier verboten zu essen. Es gab sie also im Überschuss. Um sie haltbarer zu machen wurden sie gekocht. Um sie von rohen Eiern unterscheiden zu können, wurden sie eingefärbt. Das wird als eine Erklärung gesehen, warum heute zu Ostern Eier gefärbt werden.;
Mit welchem genialen Trick schützt der australische Rosakakadu sein Gelege vor Schlangen und Waranen?;Das Gelege ist in einem Baumstamm und damit die Schlangen bzw. Warane nicht hinaufklettern können, schält er zusätzlich die Rinde unterhalb des Geleges ab und poliert die Stelle mit seinen Federn glatt.;
Mit welchem genialen Trick schützt die Kanincheneule ihre Jungen vor Feinden?;Die Kanincheneule lebt am Boden und die größte Gefahr für die Jungen sind Wiesel. Diese vertreibt die Kanincheneule, indem sie mit dem Schnabel Klapperschlangengeräusche nachmacht, die das Wiesel verschrecken.;
Mit welchem Grund besuchte man Anfang der 20er Jahre in Hamburg immer wieder die „Eiserne Jungfrau“?;Es war die erste Benzinzapfsäule Deutschlands.;
Mit welchem Hilfsmittel wollte der amerikanische Arzt George Taylor 1869 die „weibliche Hysterie“ heilen?;Er erfand den ersten Vibrator. Die „Maschine“ wurde anfangs nur in Arztpraxen & Kliniken verwendet. Man verstand darunter „die Auflehnung des Unterleibs gegen sexuelle Unterversorgung“;
Mit welchem Marketing-Trick hat die Firma „Camelia“ in den 50er-Jahren Käuferinnen für Damenbinden geködert?;In jeder Packung war ein Zettel mit der Aufschrift: „Bitte geben sie mir eine diskret verpackte Cameliaschachtel“, den man in Damenbekleidungsgeschäften (damals konnte man nur dort Binden erhalten) vorzeigen konnte, ohne danach fragen zu müssen.;
Mit welchem nicht ganz legalen Trick gelang es einem Mann aus Rostock, jahrelang Steuern zu sparen?;Er gab seinen zotteligen Hund als Schaf aus und sparte die Hundesteuer.;
Mit welchem sportlichen Wettbewerb wurde am 26.März 1916 das Berliner Olympiastadion eröffnet?;Mit einem Handgranatenweitwerfen! Ursprünglich sollten 1916 in Berlin die olympischen Sommerspiele stattfinden, für die das Stadion auch gebaut worden war. Weil aber der 1. Weltkrieg dazwischen kam, organisierte das Kriegsministerium kurzerhand selbst ein paar Wettkämpfe – darunter das Handgranatenweitwerfen.;
Mit welchem Trick erschreckt die Hakennasentrugnatter ihre Feinde so sehr, dass sie schnell das Weite suchen?;Sie saugt über ihren Hinterausgang sehr viel Luft an und lässt dann mit lautem Knall einen fahren (ca. 70 dB – so laut wie ein Staubsauger);
Mit welchem Trick geht man in der italienischen Stadt Portogruaro gegen Männer vor, die einfach in Häuserecken pinkeln?;In den Häuserecken ist ein Stein so angebracht, dass in jedem Winkel wieder alles zurückspritzt.;
Mit welchem Trick schafft es die Wasserspinne fast ihr ganzes Leben unter Wasser verbringen zu können?;Sie baut sich eine Taucherglocke aus Wasserpflanzen und Spinnweben. Durch ruckartiges Eintauchen bleiben an ihren Beinen Luftbläschen hängen, die sie in die Taucherglocke bringt. Wenn dann in ihrer Behausung genügend Luft ist, webt sie Signalfäden von der Taucherglocke zu anderen Wasserpflanzen. Wenn dort ein Tier hängen bleibt, kommt die Spinne aus ihrer Taucherglocke - holt ihre Beute und bringt diese zurück in die Taucherglocke.;
Mit welchem Trick schafft es ein tropischer Fisch stundenlang an Land nach Insekten zu jagen?;Er verfügt über kleine Beutel im Maul. Diese füllt er mit Wasser, womit er seine Kiemen feucht hält und somit die Kiemenatmung weiter funktioniert.;
Mit welchem Trick schützen Japans Handyhersteller Mädchen und Frauen davor, heimlich fotografiert zu werden?;Fast alle Handys, die in Japan auf den Markt kommen (also auch von anderen Herstellern) sind so programmiert, dass sich das Auslösegeräusch der eingebauten Kamera nicht auf stumm schalten lässt. Dadurch kann niemand mehr heimlich fotografiert werden.;
Mit welchem Trick schützt die Kap-Beutelmeise ihr Nest vor räuberischen Schlangen?;Sie verschließt den Eingang zum Nest und legt einen zweiten an, der nicht zu den Eiern hinführt.;
Mit welchem Trick schützt die Stadt Neapel neuerdings ihre Touristen vor dreisten Uhrendieben?;Beim Einchecken ins Hotel werden die Touristen gefragt, ob sie ihre Uhr anbehalten wollen. Wenn nicht, kommt die Uhr in den Safe und die Touristen bekommen leihweise eine billige Plastikuhr, Wert 10 €. Diese Uhr klaut natürlich keiner. Verlässt man das Hotel, bekommt man seine Uhr wieder aus dem Safe zurück.;
Mit welchem Trick versucht man in Kanada, Männer dazu zu bringen, nach dem Pinkeln die Hände zu waschen?;An der Innenseite der Toilettentür ist ein lebensgroßes Plakat von einem Mann, wobei der Türgriff durch den Hosenschlitz geht. Beim Griff zum Türgriff sollen die Männer daran erinnert werden, sich die Hände zu waschen.;
Mit welcher genialen Strategie bekämpft die Ulme den Ulmenblattkäfer?;(Ulme ist ein Baum- der Schädling Ulmenblattkäfer zerlöchert die Blätter der Ulme);
Mit welcher Geste stellen Gebärdendolmetscher Angela Merkel dar?;(sieht man fast jeden Abend bei Phoenix, da dort die Nachrichten in Gebärdensprache übersetzt werden) Die Gebärdendolmetscher stellen Angela Merkel mit beiden Händen dar. Die flachen Hände werden zuerst senkrecht nach oben seitlich des Gesichts mit den Handflächen zueinander gestellt und dann werden die flachen Hände mit dem Handrücken nach oben in Höhe des Kinns gestellt. So stellt man Angela Merkel dar. Z. B. Guido Westerwelle wäre, wenn eine Hand nach Westen zeigt und dann mit der Hand eine Welle geformt wird. Stoiber wäre dann, wie wenn man mit der Hand Sand auf den Tisch fallen lässt. Also der Sand zerstäubt wird. Stäuben = Stoiber.;
Nach wem oder was wurde der Bundesligist Hertha BSC benannt?;Nach einem Berliner Dampfer, mit dem der Gründer kurz zuvor gefahren war.;
Noch bis vor 60 Jahren stand in vielen Apotheken ein Aquarium. Warum?;Um Schwangerschaftstests durchführen zu können! Frauen, die wissen wollten, ob sie schwanger waren, brachten dem Apotheker eine Urinprobe. Diese wurde einem weiblichen Exemplar des glatten Krallenfroschs injiziert. War die Frau schwanger, reagierte der Frosch aufgrund der im Urin enthaltenen Hormone, indem er innerhalb von zwei Tagen seine Eier ablegte. Daher wird der Xenopus laevis, der glatte Krallenfrosch auch „Apothekerfrosch“ genannt.;
Obwohl das Stadion werbefrei ist, kennt in Australien jeder den Sponsor von „Megas Alexandros“. Warum?;Der Sponsor ist das einzige 6-Sterne Bordell, das in Australien jeder kennt. Aus Rücksicht auf Kinder und Jugendliche wird auf Banden- und Trikotwerbung verzichtet.;
Schwanzfütterung – was ist das?;Früher war diese Methode in vielen Kuhstellen üblich, heute nur mehr in den Alpen: Die Kühe sind an den Wänden des Stalls festgebunden. Sie stehen mit den Köpfen gegen die Wand und ihre Hinterteile ragen in die Mitte des Stalls. So kann der Stall bequem ausgemistet werden. Zur Fütterung allerdings muss man am Schwanz der Tiere vorbei um die Tiere herum, deshalb spricht man von der Schwanzfütterung.;
Stirnpressen – was ist das? ;Beim Hantelstemmen legt man sich auf den Rücken, hebt mit beiden Händen die Hanteln nach oben und landet wieder auf dem Brustkorb beim Herablassen. Wenn man nun den Trizeps trainieren will, presst man die Hanteln nach oben und landet auf der Stirn. Das ist das Stirnpressen.;
Über welche ungewöhnliche Frage stimmte der US Kongress im Jahr 2011 unter anderem ab?;Ob die Tomatensauce auf Pizza gesundes Gemüse ist.;
Unter welcher Bedingung hat Porsche die neue Orgel in der Leipziger Nikolaikirche mit 1,8 Mio. Euro gesponsert?;Der Einschaltknopf der Orgel musste von rechts nach links verlegt werden, da in einem Porsche das Zündschloss links ist.;
Warum ändert sich fast jedes Jahr die Telefonnummer von Real Madrid?;Die Telefonnummer lautet 2004: 902291709 und setzt sich folgendermaßen zusammen: 902…bleibt immer gleich / 29…steht für die Anzahl der gewonnenen spanischen Meistertitel / 17…steht für die Anzahl der spanischen Pokalsiege / 09…steht für die Anzahl der Europapokalsiege → ändert sich fast jedes Jahr;
Warum balanciert der Mississippi-Alligator Stöckchen auf seiner Schnauze?;Wenn die Alligatoren schwimmende Stöcke finden, tauchen sie unter und bringen sie auf ihrer Schnauze in die richtige Position. Denn Nistmaterial ist in Vogelkolonien oft knapp, und so locken sie damit Schreitvögel wie Reiher an, die auf der Suche nach kleinen Stöcken sind. So liegen Mississippi-Alligatoren stundenlang im Wasser und balancieren kleine Zweige auf ihren Schnauzen. Nichts passiert - bis sich ein Vogel nähert und mit dem Schnabel nach dem Stöckchen greift. Das Krokodil schießt hoch - und um den Reiher ist es geschehen.;
Warum bat der Komponist Eduard Künneke 1919 in der Bar des Hotels „Adlon“ aufgeregt um eine Schere?;Während der Fahrt fielen ihm ein paar Melodien für seine Operette „Der Vetter aus Dingsda“ ein, an der er gerade arbeitete. Da er kein Papier bei sich hatte, schrieb er die Noten auf seinen Hemdärmel. Diesen wollte er dann abschneiden und spielte nicht von Blatt, sondern vom Ärmel.;
Warum bauen Biber Dämme?;Biber bauen Dämme, damit der Eingang ihrer Höhle stets unter Wasser ist. So kommen keine anderen Tiere in die Höhle und können die Nahrungsvorräte des Bibers nicht klauen.;
Warum baut das Thermometerhuhn das Nest für seine Eier schon einige Monate vor der Eiablage?;Das Thermometerhuhn brütet seine Eier nicht selbst aus sondern baut praktisch einen Brutkasten. Dazu beginnt es Monate vor der Eiablage damit Löcher zu graben die es mit Pflanzenresten füllt und mit Sand zuschüttet. Nach einigen Wochen beginnen die Pflanzenreste zu verfaulen und so entsteht Wärme. Wenn die Henne die Eier dann legt hat der „Brutkasten“ bereits die richtige Temperatur. Das Männchen kontrolliert übrigens mit seinem Schnabel regelmäßig die Temperatur im Brutkasten, deshalb heißt dieses Tier „Thermometerhuhn“.;
Warum baut man in Bali hinter Türen sehr oft eine Mauer?;(wenn man die Tür aufmacht, steht man gleich vor einer Mauer, sodass man um die Mauer herumlaufen muss, findet man in Bali bei Haustüren und auch bei Toren von Grundstückseinfahrten) Die Hindus in Bali glauben, dass böse Geister nicht scharf um die Ecke abbiegen können. Daher ist meiste eine Mauer hinter der Tür, da die bösen Geister dann gegen die Mauer knallen, weil sie nicht abbiegen können.;
Warum baute sich ein Ehepaar in Leicester (England) eine Garagentor-Attrappe vor einen Teil seines Hauses?;Um die Garage weiterhin als Wohnung nutzen zu können.;
Warum bedienen die Mitarbeiter eines Berliner Geschäfts einige Kunden nur mit Handschuhen?;Wenn jemand dort Spraydosen kauft, fassen die Mitarbeiter diese mit Handschuhen an, damit ihre Fingerabdrücke nicht darauf sind, wenn die Dosen nach illegalen Sprühaktionen zurückgelassen werden.;
Warum befinden sich auf den Walzen der meisten „einarmigen Banditen“ Fruchtsymbole?;1899 ließ die amerikanische Regierung Glückspiele verbieten- die Hersteller suchten nach einer Lücke im Gesetz: Die Leute spielten nicht mehr um Geld sondern um Kaugummikugeln (Abbildung war der Geschmack)- später lies sich der Hersteller die Walzen patentieren.;
Warum befinden sich seit 2005 auf dem Friedhof Münnerstadt 30 Gräber, an denen nie jemand trauert?;In Münnerstadt befindet sich die einzige Ausbildungsstätte für Bestatter in Deutschland. Der Lehrfriedhof (mit diesen 30 Gräbern) ist Bestandteil des normalen Friedhofes. Die Grabsteine dieser 30 Gräber haben keine Inschrift. Auf dem Lehrfriedhof wird unter anderem das Ausheben von Gräbern gelernt.;
Warum befindet sich auf dem Berliner Invalidenfriedhof mitten auf dem Hauptweg eine Grabstätte?;Der Kommandant des Invalidenhauses (Gustav Friedrich von Kessel) war so unbeliebt, dass alle einen großen Bogen um ihn machten. Deshalb verfügte er, dass die Leute auch nach seinem Tod noch einen Bogen um ihn machen müssen, und wurde mitten auf dem Hauptweg beerdigt.;
Warum befindet sich bei einem Porsche das Zündschloss links vom Lenkrad?;Das ist ein Stück Porsche-Tradition, eine geniale Idee der Rennsport-Ingenieure: Bei den ersten Autorennen in Le Mans mussten die Fahrer nach dem Startschuss noch einen kleinen Sprint hinlegen, nämlich erst mal zu den geparkten Autos rennen. Im Gegensatz zu allen anderen Fahrern konnten die Porsche-Piloten, eben weil sich bei ihnen das Zündschloss links befand, mit der linken Hand den Wagen starten und mit der rechten bereits den Gang einlegen. Und gewannen damit entscheidende Sekunden zum Sieg.;
"Warum befindet sich die 57 auf den Glasflaschen von ""Heinz Ketchup"" nicht mittig, sondern rechts über dem Etikett?";Das Klopfen auf diesen Punkt lässt den Ketchup leichter fließen.;
Warum beförderte die Lufthansa 1974 hunderttausende von Passagieren zum Nulltarif?;Damals gab es einen verfrühten Wintereinbruch, der die Zugvögel überraschte. Daraufhin brachte die Lufthansa hunderttausende von ihnen in den Süden. ;
Warum begann die Trauerfeier für Liz Taylor eine Viertelstunde zu spät?;Liz Taylor ist zu ihren Lebzeiten zu Dreharbeiten immer zu spät gekommen. Sie hat angeordnet, dass auch ihre Beerdigung mit einer Viertelstunde Verspätung beginnen solle. Außerdem hat sie veranlasst, dass an ihrer Beerdigung jemand ruft: „Sie wollte sogar zu ihrer eigenen Beerdigung zu spät kommen.“;
Warum begann Hany Ramzy auf Zuruf seines Trainers Otto Rehhagel mitten im Spiel plötzlich zu humpeln?;In Fußballteams durften nur max. drei Ausländer mitspielen. Im Jahre 1989 waren ein einem Spiel aber vier ausländische Spieler. Daraufhin rief Otto Rehhagel Hany Ramzy zu, er solle humpeln, damit er aus diesem Spiel kann und nur noch drei Ausländer im Team sind, sonst wäre das Spiel ungültig.;
Warum begattet das Kratzer-Männchen nicht nur Weibchen, sondern auch andere Männchen?;Dieser Wurm verklebt nach der Begattung eines Weibchens mit seinem Befruchtungssaft die Geschlechtsteile anderer Männchen und macht sie so für bis zu zwei Wochen unfruchtbar, so dass sie das Weibchen nicht begatten können.;
Warum begeht der Papierboot-Krake kurz nach seinem ersten Sichtkontakt mit einem Weibchen Selbstmord?;Nachdem er ein Weibchen entdeckt hat pumpt er Sperma in einen seiner Arme- bricht diesen ab und stirbt dadurch. Das Sperma im Arm befruchtet dann erst die Eier im Körper des Weibchens.;
