Was ist ein Stoßbetrug?;Beispielfall: Betrüger gründen eine Firma. Bestellen Waren in kleinen Mengen und die Rechnungen werden immer sofort bezahlt – die Firma gilt also als seriös. Dann irgendwann wird eine Großbestellung rausgeschickt die Betrügerfirma handelt mit dem Lieferanten aus, dass die Lieferung erst (z.B. eine Woche) nach Lieferung bezahlt wird. Sobald die Waren eingetroffen sind werden sie schnell billig weiterverkauft (wieder abgestoßen), der Lieferant aber nicht bezahlt, die Firma aufgelöst und die Betrüger verschwinden. Diese Art des Warenkreditbetrugs heißt deshalb (weil Waren schnell abgestoßen werden) „Stoßbetrug“.;
Was ist ein Streifensegel?;Ein Reflektor zum Aufspüren von Dellen an Autos.;
Was ist ein Stressbalken?;Die einfachen Dienstgrade bei der Bundeswehr haben auf den Schulterklappen Schrägstreifen. Unteroffiziersanwärter bekommen einen zusätzlichen Streifen der nicht schräg steht. Weil diese Soldaten sich freiwillig mehr Stress aussetzen indem sie länger bei der Bundeswehr bleiben heißt dieser Streifen „Stressbalken“.;
Was ist ein Stress-Echo?;Um herauszufinden wie gesund das Herz unter Stress schlägt, wird es gezielt unter Stress gesetzt (Pedale treten oder Medikamente). Dann werden Ultraschallwellen auf das Herz gerichtet die von dem Organgewebe wie ein Echo zurückreflektiert werden. Herz und umliegende Adern können so auf einem Monitor sichtbar gemacht werden. Diese Untersuchungsergebnisse heißen Stress-Echo.;
Was ist ein Stuttgarter Gurt?;Der Stuttgarter Gurt verhindert, dass Implantate nach einer Brustvergrößerung nach oben rutschen. Durch den Druck bleibt die Symmetrie erhalten. Die Erfinderin Dr. Gabriele Fricker war in der Stuttgarter Klinik für plastische Chirurgie beschäftigt. Daher nennt man dies den Stuttgarter Gurt.;
Was ist ein Suchtsack?;Ein Sack mit verschiedenen Suchtmitteln (Alkohol, Zigaretten, Tabletten, Kaffee, Spritzen…). Diesen Sack können Lehrer im Unterricht über Suchtprävention verwenden.;
Was ist ein Suppenbrunzer?;Suppenbrunzer ist ein alter Begriff für Gegenstände, die in einer Essecke über dem Tisch hängen, wie zum Beispiel Heilig Geist-Tauben in einer Glaskugel. Bei heißen Speisen steigt der Dampf auf, sammelt sich an der Kugel und tropft dann in die Suppenschüssel. Im Volksglauben hat der Heilige Geist damit in die Suppe gebrunzt und sie gesegnet.;
Was ist ein Tanzmeister?;Ein Messwerkzeug.;
Was ist ein Tastbesteck?;Mit diesem Werkzeug kann man Zylinderschlösser knacken. (Die spitzen Ministifte die normalerweise von den Zacken des Schlüssels erfasst werden kann man damit einzeln ertasten und herunterdrücken) Ein Sportgerät für „Lockpicker“! (Leute die aus sportlichem Ehrgeiz komplizierte Schlösser knacken);
Was ist ein Teilzieher?;Zugvögel, deren Population nicht vollständig Richtung Süden zieht, sondern nur Teile der Population.;
Was ist ein Teppichstripper?;Eine Maschine die festgeklebten Teppichböden entfernt.;
Was ist ein Textilvergehen?;Das Textilvergehen findet man im Regelwerk des Deutschen Fußballbundes. Zieht ein Spieler dem anderen am Trikot oder der Hose, nennt man das ein Textilvergehen und wird mit roter Karte bestraft.;
Was ist ein Tiefeinsteiger?;Ein Fahrrad;
Was ist ein Tigerschecke?;Ein Pferd.;
Was ist ein Toilettentrainer?;Ein Toilettenaufsatz (mit Stiege) für Kleinkinder (damit sie das Klogehen trainieren können);
Was ist ein Tollwurm?;Das Zungenbändchen beim Hund wird Tollwurm genannt, weil es ein wurmförmiges Stück Gewebe unter der Zunge ist, dass früher für den Erreger von Tollwut gehalten wurde. (Deshalb wurden bis zur Entdeckung des echten Tollwuterregers dieses Stück vielen Hunden entfernt. Es dient der Stabilisierung der Zunge beim Trinken);
Was ist ein Touristenentferner?;Bei manchen Bildbearbeitungsprogrammen (Computersoftware) gibt es diese Funktion. Damit kann man bei Fotos Touristen, die einem ins Bild gelaufen sind, aus dem Bild entfernen.;
Was ist ein Tränenstreifen?;Zum Beispiel Geparden haben einen Tränenstreifen. Es handelt sich um auffällige Streifen im Gesicht des Tieres. Die schwarzen Streifen im Fell gehen von den inneren Augenwinkeln bis zum Maul. Das sieht dann so aus, wie heruntergelaufene schwarze Tränen, daher Tränenstreifen.;
Was ist ein Treibglied?;Treibglieder findet man an der Kette einer Motorsäge. Das Treibglied sorgt dafür, dass die Kette in das Antriebsritzel eingreift, die Säge damit ins Laufen kommt.;
Was ist ein Triebbohrer?;Gelbe Larve der Blattwespe, die sich durch den Stengel der Rose bis zur Spitze hochfrisst.;
Was ist ein Trimmgalgen?;Vorrichtung zum „Trimmen“ von Terriern (die abgestorbenen Haare werden gezupft);
Was ist ein Triple Willy?;Triple Willy ist ein Toilettenpapierspender für drei Toilettenpapierrollen. Ist eine Rolle leer, wird die nächste automatisch bereitgestellt.;
Was ist ein Trockenanschlag?;Wenn ein Sportschütze seine Bewegungsabläufe mit ungeladener Waffe (oder ohne Waffe) probt.;
Was ist ein Trockengehschutz?;Eine Abschaltautomatik in Wasserkochern.;
Was ist ein Trockenläufer?;Wenn bei Heizkraftanlagen der Motorbereich und der Nassbereich (wo das Wasser erhitzt wird) räumlich von einander getrennt sind, dann läuft der Motor im Trockenen – Trockenläufer.;
Was ist ein Trockensteher?;Eine hochschwangere Milchkuh (4 Wochen vor dem Abkalben werden sie nicht mehr gemolken = trocken gestellt);
Was ist ein Trockensteher?;Eine Kuh, die vier Wochen vor dem Kalben nicht mehr gemolken wird.;
Was ist ein Tropengummi?;Die Rückseite von Briefmarken, die aus Automaten kommen, ist mit einem speziellen Klebegummi beschichtet. Dieser Gummi verhindert, dass die Briefmarken, die sich auf einer Rolle befinden, nicht aneinander kleben bleiben, wenn es zu Schwitzwasser im Automaten kommt. (Schwitzwasser entsteht besonders in Nächten nach warmen Tagen) Dieser Klebegummi wird sonst vor allem in den Tropen eingesetzt und heißt deshalb „Tropengummi“.;
Was ist ein Tropfbett?;Wen ein Hirsch von einem Jäger lediglich angeschossen wird – der Schuss also nicht tödlich ist und der Hirsch noch weiterlaufen kann - überall wo der Hirsch auf seiner Flucht stehen bleibt entsteht durch das Blut, das aus der Wunde tropft, eine kleine Blutpfütze am Waldboden. Eine solche Blutpfütze heißt „Tropfbett“.;
Was ist ein Tropfhaus?;Die Behausungen von vielen Landarbeitern und Tagelöhnern, die im 18.Jahrhundert in vielen Regionen Bayerns lebten hießen so, weil der Besitz der Leute nur so weit reichte, wie das Regenwasser vom Hausdach tropfte.;
Was ist ein Trottelbecken?;Trottelbecken nennt man ein Aufzuchtbecken für junge Seehunde. Seehunde, die sich beim Futtern dämlich anstellen, bekommen dort das Futter direkt ins Maul. Daher nennt man dies ein Trottelbecken.;
Was ist ein Trümmerdackel?;Trümmerdackel ist die in Versicherungskreisen gebräuchliche Bezeichnung für Sachverständige die Unfallfahrzeuge begutachten.;
Was ist ein Trümmerschatten?;Bei einem Gebäudebrand müssen Feuerwehrautos einen Sicherheitsabstand zum Gebäude einhalten falls eine Wand zusammenbricht würden sonst Trümmer die Autos beschädigen. Dieser Trümmerschatten beträgt ca. 2/3 der Gebäudehöhe. In diesem Schattenbereich würden die Trümmer runterfallen.;
Was ist ein Tuckenball?;Tuckenball nennt man einen misslungenen Wurf beim Bowling, der trotzdem einen Strike bringt.;
Was ist ein Turmschuss?;Wenn ein Baukran aufgebaut wird besteht dieser aus einzelnen Teilen. Weil der Kran wie ein Turm Stück für Stück nach oben „schießt“, heißt jedes dieser Einzelteile „Turmschuss“.;
Was ist ein Turnschuhnetzwerk?;Ein Ausdruck für den Datenaustausch zwischen mehreren PSs per USB-Stick.;
Was ist ein Türspringer?;Bei Übungen der Fallschirmspringer der Bundeswehr sind bis zu dreißig Springer beteiligt die in zwei Reihen vor den beiden Absprungöffnungen links und rechts stehen. Der erste Fallschirmspringer der aus einer Reihe zur Tür geht und springt heißt Türspringer.;
Was ist ein Tuttischwein?;Streicher in einem Orchester. Diese spielen immer nur gemeinsam, aber nie einzeln.;
Was ist ein Typengummi?;Eine gummiartige Knetmasse mit der die Typen (Lettern) von Schreibmaschinen gereinigt werden können. Diese Typen werden von Staub und Farbresten befreit indem man diese Knetmasse fest darauf drückt. Beim Wegnehmen der Knetmasse bleiben Staub und Farbreste dann nämlich an diesem „Typengummi“ hängen.;
Was ist ein Übungsgummi?;Übungsgummi ist eine runde Gummiplatte, auf der geräuscharm Schlagzeug geübt werden kann. Bei manchen Ausführungen ist diese Gummiplatte auf einem Holzbrett aufgebracht und kann so für Trommel-Trockenübungen verwendet werden.;
Was ist ein Uhrmacherkrampf?;Ein Krampf im Auge, der vor allem Uhrmacher betrifft.;
Was ist ein Umwandlungsmännchen?;Umwandlungsmännchen nennt man die männlichen Exemplare bestimmter Tierarten, die ihr Geschlecht ändern können. So sind z. B. die Jungtiere des im Meer lebenden Ringelwurms der Gattung Ophryotrocha alle männlich, werden aber zu Weibchen, wenn sie ein Wachstumsstadium von rund 20 Körpersegmenten erreicht haben. Schneidet man diese Weibchen auf 5 bis 10 Segmente zurück, so wandeln sich die Tiere wieder in Männchen um.;
Was ist ein Untendreher?;Wenn bei einem Kran nur der Arm beweglich ist (der ja oben ist) ist dieser Kran ein Obendreher. Ist er aber auch am Fuß (also unten) um die eigene Achse drehbar ist er ein Untendreher.;
Was ist ein Unterhaltungsstau?;Eine lange nicht getätigte Sanierung einer Immobilie.;
Was ist ein Unterzwerg?;Riesensterne haben einen Durchmesser von etwa 2 Milliarden Kilometer. Zwergsterne haben hingegen nur einen Durchmesser von ein paar Millionen km. Sterne der gleichen Klasse leuchten meist gleich hell. Zwergsterne die einige Stufen unter der durchschnittlichen Helligkeit leuchten heißen Unterzwerge.;
Was ist ein unvollständiger Überlauf?;Wasser schwappt über eine Wehrbegrenzung nicht in einem Rutsch, sondern es schwappt auch wieder zurück, und wieder vor und zurück...;
Was ist ein Urlaubsversager?;Begriff aus dem deutschen Justizvollzug: Wenn ein Gefangener sich im Hafturlaub nicht an die Regeln hält und zu spät ins Gefängnis zurückkehrt oder eine Straftat begeht, spricht man von einem Urlaubsversager (weil er im Urlaub versagt hat).;
Was ist ein Ventilwächter?;Ein Ventilwächter ist eine Wegfahrsperre für Autos. Auf jeden Autoreifen wird ein Ventilwächter aufs Reifenventil getan und dann abgesperrt. Wird nun das Auto mehr als 600 Meter entfernt, drückt der Ventilwächter auf den Stift im Autoreifen und die Luft entweicht. So kann man dann nicht weiterfahren, da die Luft in den Reifen fehlt. Wegen des Ventilwächters.;
Was ist ein Versammlungsstoß?;Beim klassischen Billard mit drei Kugeln versucht der Spieler mit einer Kugel die beiden anderen zu treffen. Wenn es dem Spieler gelingt mit einem Stoß die drei Kugeln in unmittelbarer Nähe zueinander zu platzieren, spricht man von einem Versammlungsstoß.;
Was ist ein Versorgungsschatten?;Wenn bei einem Baum ein Ast amputiert wird kann es zu Fäulnisprozessen kommen, die dazu führen dass ein Bereich des Baumes nicht mehr mit Nährstoffen versorgt werden kann. Es herrscht also ein Schatten was die Versorgung mit Nährstoffen angeht. (Vgl: Sprichwort „Wo Licht ist, da ist auch Schatten“) Man wollte dem Baum helfen, indem man einen Ast entfernt, aber als negative Folge hat man auch einen Versorgungsschatten, also einen Bereich wo die Versorgung nicht mehr funktioniert.;
Was ist ein Verstopfungszuschlag?;Entstehen beim Entladen von Schiffen längere Wartezeiten als geplant, wird bei der Frachtberechnung von Speditionen ein Zuschlag erhoben, der sogenannte Verstopfungszuschlag.;
Was ist ein Verzögerungspapier?;Wenn eine Treppe aus Beton gegossen wird, wird auf die Oberfläche jeder Stufe ein Papier gelegt. Dieses Papier bedeckt die Trittfläche und ist mit einer Zuckerlösung überzogen, dadurch wird das Aushärten der obersten Schicht verzögert. (Damit die Oberfläche der Treppe am folgenden Tag noch bearbeitet werden kann- z.B. mit einer Wischtechnik);
Was ist ein Verzögerungstuch?;Es verhindert beim Fallspringen, dass sich der Fallschirm schlagartig entfaltet;
Was ist ein Vibrationsbär?;Eine Ramme zum Eintreiben von Spundbohlen ins Erdreich (nicht so laut wie z.B. Presslufthammer);
Was ist ein Vollsauger?;Etwas („Minipümpel“) um harte Kontaktlinsen aus dem Auge zu entfernen. (Für weiche Kontaktlinsen wird ein Hohlsauger verwendet.);
Was ist ein Vollziehungsstrich?;Vollziehungsstrich ist ein Begriff aus dem Mittelalter. Frühere Herrscher, Fürsten, Könige und Kaiser, konnten meist weder lesen noch schreiben. Wichtige Dokumente wurden per Siegel beglaubigt. Ein mächtiges Siegel war das Herrschaftsmonogramm. Schreibkundige setzten es auf das Dokument und der Herrscher machte nur noch ein bis zwei Striche aus eigener Hand dazu. Die Unterschrift wurde sozusagen nur mit einem Strich vollzogen, daher Vollziehungsstrich.;
Was ist ein Vorbläser?;Ein Arbeiter in einer Glasbläserei, der das Glas in eine Art Rohling bläst, damit der Einbläser es weiter verarbeiten kann. Denn die ganze Arbeit wäre für einen einzelnen zu anstrengend.;
Was ist ein Vorderzappler?;Eine Uhr mit Pendel.;
Was ist ein Walzenstuhleinlauf?;Vorgang, bei dem das Getreide in einer Mühle durch einen Trichter zwischen den Walzen läuft.;
Was ist ein Wanderbläser?;In der Textilindustrie: Bei der Herstellung von Baumwolltextilien „wandert“ dieses Gerät über die Stoffbahnen und bläst frei herumfliegende Baumwollfasern weg, damit diese nicht in den Stoff eingenäht werden.;
Was ist ein Wanderbock?;Manche Imker „wandern“ mit ihren Bienenkästen umher. (Dadurch sammeln die Bienen unterschiedlichen Nektar, was sich auf den Geschmack des Honigs auswirkt). Diese mobilen Bienenkästen werden nicht auf den Boden, sondern auf einen Bock gestellt, mit denen die Imker die Bienenstöcken durch die Gegend fahren kann. Dieser Bock heißt deshalb Wanderbock.;
Was ist ein Wandspieler?;Im Fußball bei einem Doppelpass: der Spieler, der den Ball wie eine Wand gleich wieder zurückspielt.;
Was ist ein Warzenbeißer;Eine Heuschreckenart (sie kann sehr fest zubeißen und sondert dabei einen ätzenden, braunen Saft ab, der laut altem Glauben Warzen beseitigen kann);
Was ist ein Warzensauger?;Ein Papieransauger in Druckmaschinen.;
Was ist ein Wasserfallständer?;Einen Wasserfallständer sieht man z.B. in Textiliengeschäften. Das sind die Ständer, an denen die Hemden gestaffelt nach unten hängen, wie ein Wasserfall. Dort können z. B. auch Teppichmuster hängen.;
Was ist ein Wasserregal?;Ein königliches Hoheitsrecht zur Nutzung von Wasserquellen.;
Was ist ein Wechselrichter?;Wenn man Solaranlagen auf dem Dach hat um Strom zu produzieren, braucht man einen Wechselrichter. Solaranlagen produzieren Gleichstrom, aber aus deutschen Steckdosen kommt Wechselstrom. Deshalb schaltet man ein kleines Gerät hinter die Solarzellen, den so genannten Wechselrichter, der den Gleichstrom in Wechselstrom umwandelt (richtet).;
Was ist ein Wechselsack?;Ein lichtdichter Sack (darin wurde der Film von Kameras früher gewechselt).;
Was ist ein Werfgehenge?;Große Tore brauchen besonders stabile, große Eisenscharniere. Diese heißen „Werfgehänge“ und müssen so stark, dass das Tor sicher „hängt“ und damit das Öffnen und Schließen (Aufwerfen und Zuwerfen) funktioniert.;
Was ist ein Wetterstern?;Wetterstern ist ein Pilz, der sich bei Regen öffnet und bei Sonne schließt. Also je nach Wetterlage offen oder geschlossen ist. Den Wetterstern kann man essen, schmeckt aber nicht.;
Was ist ein Wickelfisch?;Der Wickelfisch ist ein wasserdichter Badesack, der es möglich macht beim Schwimmen Sachen mitzunehmen. Die Gegenstände werden in den fischförmigen Sack getan, der vom Schwanzende her aufgewickelt und verschlossen wird.;
Was ist ein Wiesenschleicher?;Modellflugzeuge mit geringer Motorleistung erkennt man daran, dass sie langsam und in geringer Höhe über die Wiese „schleichen“. Diese Modellflugzeuge heißen deshalb „Wiesenschleicher“.;
Was ist ein wilder Hausrüttler?;Der Name für Blitze mit der höchsten Stromstärke.;
Was ist ein Williwärmer?;genau das was man sich beim ersten Mal hören drunter vorstellt… 😉;
Was ist ein Willybecher?;Offizielle Bezeichnung für das deutsche Standard-Trinkglas. Die Idee hatte um 1950 hatte Wilhelm Steinmacher.;
Was ist ein Windsichter?;Eine Maschine in einer Recyclinganlage: Der unsortierte Müll läuft auf einem Förderband an dieser Windmaschine vorbei, die durch ihr Gebläse die schweren von den leichten Teilen trennt. Der Müll wird also vom Wind gesichtet.;
Was ist ein Windspringer?;Windspringer ist ein Begriff aus dem Fallschirmsport. Beim Zielspringen muss man exakt auf einem vorher festgelegten Punkt landen. Da die Windverhältnisse hierbei eine große Rolle spielen, springen vorher meist schon ein paar Fallschirmspringer, um so Informationen über die Windverhältnisse zu bekommen. Diese Springer, die vorher springen, um die Windverhältnisse zu ermitteln, nennt man Windspringer.;
Was ist ein Windspringer?;Beim Zielspringen, wo die Fallschirmspringer auf einen vorher genau bestimmten Punkt landen müssen, springen vor dem Wettbewerb ein paar Fallschirmspringer ab die Daten über die herrschenden Windverhältnissen sammeln. Diese Vorspringer heißen deshalb Windspringer…;
Was ist ein Winkelstück?;Ein Zahnarztbohrer.;
Was ist ein Wintersteher?;Sträucher deren Früchte auch in den Wintermonaten an den Ästen hängen bleiben. (Die Früchte „stehen“ an den Ästen) z.B. Vogelbeere;
Was ist ein Winterverstärker?;Ein verdichteter Busfahrplan.;
Was ist ein Wörterbuchangriff?;Hacker verwenden um Passwörter zu knacken Programme, die mit dem Inhalt mehrerer Wörterbücher gefüllt sind und alle Wörter daraus durchtesten. (Da viele Leute einfache, leicht merkbare Wörter als Passwörter verwenden wird dieser Wörterbuchangriff von Hackern eingesetzt);
Was ist ein Wurfsack?;Wurfsack ist ein röhrenförmiger Kunststoffsack, in den innen ein Schwimmkörper eingebaut ist, mit einem ca. 20 m langen Seil. Dieser Wurfsack ist Grundausstattung jedes Paddelbootes, da ein Paddelboot für einen Rettungsring zu klein ist. Gerät eine Person in Seenot, wirft man ihr den Wurfsack zu und kann die Person an dem Seil wieder zum Boot ziehen.;
Was ist ein Würgenippel?;Bei einer Stromabzweigdose werden die Kabel durch die Würgenippel in die Dose eingeführt. Vorteil ist, dass so kein Staub etc. in die Dose eindringen kann.;
Was ist ein Zapfenschieber?;In der Dusche: Das Zwischenstück zwischen Wandstange und Duschkopf, das nach oben und unten verschiebbar ist.;
Was ist ein Zehenaufzug?;Der Zehenaufzug ist Bestandteil eines Hufeisens. Es handelt sich dabei um eine eiserne Kappe die an der Außenseite des Hufeisens „aufgezogen“ wird, um dem Eisen besseren Halt am Hufeisen zu geben. (Der vordere Teil des Pferdehufes heißt „Zehe“);
Was ist ein Zeigerbär?;Wenn im Zoo Bärennachwuchs geplant wird, muss man erst schauen, ob ein Weibchen empfängnisbereit ist. Bärenweibchen sind nur drei Monate im Jahr empfängnisbereit. In dieser Zeit hinterlassen sie einen bestimmten Duft. Um diese Zeit zu ermitteln, wird ein unfruchtbares Bärenmännchen ins Weibchengehege getan (Männchen und Weibchen sind im Zoo in getrennten Gehegen). Das Männchen zeigt durch sein Verhalten, dass das Weibchen in Stimmung ist. Dieses Bärenmännchen nennt man Zeigerbär. Anschließend kann das Bärenweibchen von einem fruchtbaren Männchen befruchtet werden oder wird künstlich befruchtet.;
Was ist ein Zeitball?;Ein von einem Turm fallender Ball, durch den Seefahrer die Uhrzeit ermittelten.;
Was ist ein Zettelbaum?;„Zettel“ kommt vom mittelhochdeutschen Wort „zetten“, was so viel bedeutet wie „ausstreuen“. „Gezettet“ wird in einer Weberei: Das Garn von mehreren Rollen wird auf eine riesige Rolle „gestreut“. Die Fäden werden nebeneinander auf diese riesige Spule (den Zettelbaum) gezettelt.;
Was ist ein Zisterzienser?;Ein Mitglied eines katholischen Ordens.;
Was ist ein Zitterzahn?;Ein Pilz. (Hat viele kleine zahnförmige Stacheln an der Unterseite. Berührt man den Pilz bewegen sich diese „Zähne“ hin und her, wie wenn sie zittern würden);
Was ist ein Zombie-Prozess?;Der Zombie-Prozess ist ein Begriff aus der Informatik. Zum Beispiel hat man am Computer in Word was geschrieben und beendet dann Word. Dann kann es sein, dass der PC Word nur augenscheinlich geschlossen hat, aber sich noch mit Word beschäftigt. Der PC arbeitet dann immer langsamer, weil er ja im Hintergrund mit Word beschäftigt ist. Das kann so weit gehen, bis der PC abstürzt. Diesen Vorgang nennt man Zombie-Prozess, da das Programm Word ja nicht wirklich geschlossen („tot“) ist, sondern nur augenscheinlich, wie ein Zombie, der auch nicht „richtig tot“ ist.;
Was ist ein Zuckergast?;Ein Silberfischchen heißt auch Zuckergast (ernährt sich Hauptsächlich von Zucker und Stärke);
Was ist ein Zungenprüfer?;Vorrichtung an einer Eisenbahnweiche  (mit einem Sensor überprüft es ob die Weiche richtig gestellt ist);
Was ist ein Zungenschuss?;Biologen nennen es Zungenschuss, wenn ein Chamäleon seine Zunge mit 20 km/h heraus schießen lässt um das Beuteinsekt zu schnappen.;
Was ist ein Zuspritzschenkel“?;Medizin: Wenn ein Patient zum Beispiel künstlich ernährt werden muss, bekommt er über eine Sonde flüssige Nahrung und eventuell zusätzliche Medikamente. Dazu ist am Ende des Schlauches ein Y-förmiges Plastikstück. Durch den einen Arm des Y kommt die Nahrung und durch den anderen die Medikamente. Dieses Y-förmiges Plastikstück heißt Zuspritzschenkel.;
Was ist ein Zustandsstörer?;Z.B. ein Hausbesitzer der sich nicht um wacklige Dachziegel kümmert. (Ein Zustand, der vorbeigehende Passanten gefährdet) Wenn jemand durch die Nichtbeseitigung eines Zustandes die öffentliche Ordnung stört, spricht man von einem Zustandsstörer.;
Was ist ein Zutreter?;Ein junges weibliches Schaf das mit zirka 12 Monaten zur Mutterschafsherde neu dazu tritt heißt „Zutreter“;
Was ist ein Zuwachsbohrer?;Hohler Bohrer, mit dem man eine Holzprobe aus einem Baum nehmen kann, ohne den Baum zu fällen.;
Was ist ein Zweigregler?;Hilfsmittel bei der „Weihnachtsbaumzucht“: Damit die Weihnachtsbäume im Dezember optisch ansprechend sind darf beim Heranwachsen der Bäume keine asymmetrische Zweigstellung auftreten. Deshalb wird den jungen Bäumen ein „Zweigregler“ aufgesetzt („eine Art Zahnspange für Bäume“) damit die Zweige in gleichmäßigen Abständen weiter wachsen.;
Was ist ein Zwergbrand?;Krankheit bei Weizen, Roggen und Gerste. Durch einen Pilz (Brandpilz) wächst das Getreide nicht mehr so hoch.;
"Was ist eine ""Hundeknochen-Anlage""?";Eine Form bei Modelleisenbahn-Anlagen.;
"Was ist eine ""Meerkirsche""?";Ein rötlicher Baum.;
"Was ist eine ""nasse Umfuhr""?";Eine Verlagerung von Gütertransporten auf den Wasserweg.;
"Was ist eine ""Spülkuh""?";"Eine Kuh die besonders viel Milch gibt soll möglichst viele Nachkommen haben. Dazu wird sie mit Hormonen behandelt, wodurch sie bis zu 30 Eizellen produziert. Diese Eizellen werden künstlich befruchtet. Später werden die Embryonen mit einem Schlauch aus dieser Kuh herausgespült, deshalb heißen solche Kühe ""Spülkühe"". Die herausgespülten Embryonen werden dann von anderen Kühen ausgetragen. So kann eine Spülkuh mehr Nachkommen haben, als auf natürlichem Weg.";
"Was ist eine ""Wilde Maus""?";Eine mittelgroße Achterbahn.;
Was ist eine „abgesonderte Befriedigung“?;Wenn eine Firma in Konkurs geht, werden die Bedürfnisse eines Gläubigers (der ein gesetzliches Pfandrecht hat) vorab befriedigt, bevor die Restmasse der Insolvenz in die Verteilung geht. ;
Was ist eine „aktive Platte“?;Teil einer herausnehmbare Zahnspange.;
Was ist eine „Alarmspinne“?;Ein spinnenförmiges Drahtgeflecht im Sicherheitsglas. Wird das Glas beschädigt, wird Alarm ausgelöst.;
Was ist eine „Auszieherkralle“?;Eine Vorrichtung in einer automatischen Schießwaffe: Die Auszieherkralle zieht nach einem Schuss die leere Hülse aus dem Patronenlager. (Der Auswerfer schleudert die Hülse dann aus der Waffe.);
Was ist eine „Bäckerfahne“?;Eine Stange mit feuchtem Lappen an der Spitze. Diese brauchen Bäcker mit einem Holzbackofen. Der Lappen wird im Ofen herumgeschleudert, um die letzten Rückstände von verbranntem Holz zu entfernen.;
Was ist eine „Badenutte“?;Wenn sich in einem U-Boot alle nicht waschen, fällt es keinem von ihnen auf. Wenn sich einer wäscht, wird er Badenutte genannt, weil die anderen dann merken, dass sie stinken.;
Was ist eine „bayerische Backe“?;Als „Backe“ wird die Ausbuchtung beim Kolben eines Jagdgewehrs bezeichnet. An dieser „Backe“ liegt ja auch die Backe des Jägers an. Ist diese Ausbuchtung rechteckig, spricht man von der „bayerischen Backe“, da sie hauptsächlich bei Jagdgewehren aus Bayern vorzufinden ist.;
Was ist eine „Beruhigungsschlange“?;Die Leitung für einen Zapfhahn kommt bei Brauereien meist aus dem Keller. Da in der Leitung ein großer Druck herrscht, wäre das Bier oben gar nicht zu zapfen, sondern würde nur herausspritzen. Deswegen wird an der Leitung eine Spirale aus Metall befestigt, durch die das Bier läuft und sich somit beruhigt, also Druck abbaut. Dann kann das Bier gezapft werden und würde nicht aus dem Zapfhahn herausschießen. Diese Spirale nennt man „Beruhigungsschlange“.;
