"Was ist jetzt nun eigentlich ein ""Schwipp-Schwager""?";"Ganz einfach: Also, wir nehmen an: Du hast einen Bruder und Du bist verheiratet. Dein Ehepartner hat einen Bruder - das ist Dein Schwager. Und Dein Schwager ist für Deinen Bruder der Schwippschwager. Blutsverwandtschaft besteht keine, weder zwischen Schwagern noch Schwippschwagern. Wie das im alten Ägypten war und in kleinen abgelegenen Bergdörfern noch ist, weiß ich nicht genau ;-)"
Was ist Meteorismus?;Als Meteorismus bezeichnet man Blähungen
Was machte Winston Churchill am 30.11.1874 bei einer Tanzveranstaltung im Blenheim Palacein einer Damengarderobe?;Er wurde dort geboren.
Was misst ein Fieberthermometer?;Seine eigene Temperatur
Was passiert, wenn ein Transportbeton Transportfahrzeug (vulgo 'Betonmischer') eine Panne hat, und die Trommel nicht mehr bewegt werden kann und somit der Beton aushärten kann.;Tatsächlich ist sowas schon passiert, und wenn die Trommel voll ist, muss sie ausgebaut und weggeworfen werden. Wenn sich nur eine kleine Menge Frischbeton in der Trommel befindet, kann offenbar auch jemand hineinklettern und den harten Beton mit dem Presslufthammer herausmeisseln. (Man muss sich mal vorstellen, was das wohl für einen Lärm macht!) Aber auch dabei wird die Trommel beschädigt.
Was rollt gegen Sommer auf Seide über die Alpen?;Die Tour de France – weil die Reifen z.T. aus hochfester Seide hergestellt sind.
"Was sind die ""sieben Weltmeere""?";"Es gibt natürlich die bekannten drei ""Ozeane"" (atlantischer, pazifischer und indischer Ozean) dazu gibt es noch acht (!) ""Mittelmeere"", also weitgehend von Landmassen umschlossene Nebenmeere eines Ozeans. Diese unterteilt man in vier große (das Arktische (Nordpolarmeer), das Amerikanische (Karibische See und Golf von Mexiko), das Australische (Begrenzt von den Sundainseln, Australien, Neuguinea, den Philippinen und dem asiatischen Festland), und unser Europäisches Mittelmeer. Wegen ihrer Bedeutung wurden sie früher als selbstständige Meere betrachtet und zu den ""Sieben Weltmeeren"" gezählt. Die restlichen ""Kleinen Mittelmeere"" sind: Ostsee, Hudson Bay, Rotes Meer und Persischer Golf. Außerdem gibt es noch Randmeere, die lediglich breite Einbuchtungen von Landmassen darstellen (Bsp.: Nordsee)."
Was sind Duckdalben?;Duckdalben sind die Holzpfähle, an denen die Schiffe festgemacht werden.
Was sind Ealing Comedies ? ;"Der Name ist eine gebräuchliche Verballhornung von ""Healing Comedies"", eine speziell britische Humorfilmform, die mit der Einführung des britischen kostenlosen Gesundheitssystems begann und um 1955 endete. In diesen Filme spielte normalerweise ein dralle blonde Krankenschwester mit Cockney-Akzent mit (daher Aussprache ""ealing"" statt ""healing"" )"
Was sind Epheliden?;Epheliden sind Sommersprossen.
Was sind Futures?;"Futures sind kurz gesagt Termingeschäfte.  Man kennt das aus dem Film ""Die Glücksritter"" mit Eddie Murphy. Das heißt, man schließt einen Vertrag zu einem bestimmten Zeitpunkt, eine bestimmte Ware, zu einem bestimmten Preis zu kaufen bzw. zu verkaufen.  Beispiel (sehr grob) Auf einem Volksfest stellt ein junger Mann fest, dass mittlerweile eine Maß Bier 10,- DM kostet. Er geht davon aus, dass die Maß im nächsten Jahr mehr als 11,- Dm kosten wird. Deshalb reserviert er beim Wirt für sich einen Krug Bier zum alten Preis, der Wirt verlangt dafür eine Gebühr von 1,- DM. Die Vereinbarung gilt bis zum nächsten Volksfest.  Damit hat der Bierfreund das Recht erworben, einen Liter Bier für 10,- Dm zu erwerben. (Basispreis) Hierzu kommt noch der Optionspreis von 1,- DM Der Bierpreis muss also über 11,- DM steigen, damit unser cleverer Freund einen Gewinn macht. Seine Prognose geht auf: Im folgenden Jahr steigt der Preis sogar auf 12,- DM Er kann nun seine Option ausüben und einen Liter Bier für 10,-DM kaufen. Danach entschließt er sich, den Liter für 12,-DM weiterzuverkaufen. Eine Mark riskiert, zwei Mark eingenommen. Gewinnspanne auf den Optionseinsatz 100 Prozent. Der Bierpreis ist aber nur um 20 Prozent gestiegen. Hier kommt die Hebelwirkung zur Geltung, die Termingeschäfte (oder Optionsscheinhandel) so attraktiv macht. Bei einem Preis von 10,50 DM für eine Maß, hätte er allerdings einen Verlust von 50 Prozent erlitten, wäre der Bierpreis unverändert geblieben, hätte er sogar seinen kompletten Einsatz verloren.  Dieses Beispiel wurde gut geklaut aus : Euro am Sonntag. Beim richtigen Terminhandel hätte unser Bierliebhaber, sein Bezugsrecht zwischenzeitlich verkaufen können, je nachdem wie sich die Marksituation verändert hätte sogar mit deftigem Gewinn, allerdings bleibt das Risiko für den, der am Stichtag das Bezugrecht besitzt, der muss nämlich das Bier zum vereinbarten Preis abnehmen, egal was der Liter dann kostet. Das ist bei Bier noch halb so wild, kommt man aber auf diesem Weg in den Besitz von 150 lebenden Schweinen, ist der Spaß schnell vorbei. Echte Termingeschäfte sind allerdings brutal viel komplexer. Wer den Markt nicht genauestens kennt, kann sehr schnell auch viel Geld verlieren."
Was sind Satellitenmännchen?;Es handelt sich um Ochsenfrösche, deren Lockruf so mickrig ist, dass sie kein Weibchen finden. Deshalb befinden sie sich in der Nähe von größeren, stärkeren Ochsenfröschen, die die Weibchen anlocken. Wenn eins kommt, fangen sie es vorher ab, um auch mal zum Zuge zu kommen.
Was steckt hinter der Sitte beim Gähnen die Hand vor den Mund zu nehmen?;Man hatte im Mittelalter die Angst, dass die Seele aus dem Körper geht bzw. böse Geister durch den Mund in den Körper kommen.
"Was versteht man eigentlich unter einem ""Zapfenstreich"" und woher kommt das.";"Als ""Zapfenstreich"" bezeichnet man das Signal, das den Soldaten anzeigt, dass sie in der Kaserne sein müssen. Ursprünglich ging der Feldwebel an den Bierfässern der Marketender vorbei und strich (klopfte) mit einem Stab über den Zapfhahn. Damit wurde der Ausschank eingestellt. Dann gibt es noch den ""Großen Zapfenstreich"" ein militärmusikalisches Ritual, das nur zu besonderen Anlässen durchgeführt wird. Rezept Zapfenstreich preußischer Art: Man nehme: 1 Musikkorps, 1 Kompanie Infanterie, Fackelträger. Die Musikfolge besteht (in der Original preußischen Tradition von 1838) aus: Serenade (bestehend aus Werken großer Meister und Lieblingsmelodien des mit dem Zapfenstreich zu Ehrenden) und dem eigentlichen Zapfenstreich mit der Folge: Locken, Zapfenstreichmarsch, Harmonischer Zapfenstreich der Reiterei (die „3 Posten”), Zeichen zum Gebet, Gebet („Ich bete an die Macht der Liebe ...”), Abschlagen nach dem Gebet, Ruf nach dem Gebet (dem Amen in der Liturgie entsprechend), Nationalhymne. Jetzt darf man nicht glauben, dass ein solches pompöses Ritual nur im deutschen Raum existiert. Das englische ""Tattoo"", das alljährlich zum Geburtstag von Queen Lisbeth aufgeführt ist, ist nichts anderes. ""Tattoo"" leitet sich ab aus dem holländischen (Wilhelm von Oranien war ja mal Chef in England) ""tat to"" (oder so ähnlich) was nichts anderes heißt, als ""Zapfhahn zu"". "
Was versteht man unter Nullipara?;Es ist eine Frau, die noch nie entbunden hat. Primipara: Eine Frau die zum ersten Mal entbunden hat (Erstgebärende). Pluripara: Eine Frau, die 2–5-mal entbunden hat Mehrgebärende). Multipara: Eine Frau, die mehr als 5-mal entbunden hat (Vielgebärende). 
Weißt Du, was die Abkürzung IKEA bedeutet?;"Die Abkürzung bedeutet nicht etwa ""Idioten kaufen einfach alles"" sondern steht für ""Ingvar Kamprad aus Elmtaryd bei Agunnaryd"". Ingvar Kamprad gründete 1943 das Unternehmen, er stammte von dem Elmtaryd bei dem südschwedischen Dorf Agunnaryd. IKEA verkaufte anfangs Kugelschreiber, Geldbörsen, Bilderrahmen, Uhren, Schmuck und Nylonstrümpfe."
Welche Nationalität hatte Kleopatra.;Kleopatra war Ptolemäerin. Sie war die letzte griechische Königin außerhalb Griechenlands von Abstammung des makedonischen Generals Ptolemäus, der an der Seite Alexanders des Großen gekämpft hatte.
Welche Sprachen schreiben wie die Deutschen nicht nur Eigennamen und Satzanfänge groß? Warum die und andere nicht? ;"Mir fiel so auf Anhieb keine andere Sprache ein. Für Kyrillisch und andere Schriftsprachen, kann ich allerdings nicht die Hand ins Feuer legen.  Die Entwicklung unserer europäischen Schrift beginnt mit der Römischen ""Capitalis Quadrata"" die nur aus Großbuchstaben bestand. Erst im 8 Jhd. n. Chr erschienen Kleinbuchstaben in einer ""Halbunziale"" genannnten Schrift. Die verbreitetste Schrift des Mittelalters war die ""karolingische Minuskel"", die wie der Name schon sagt, nur aus Kleinbuchstaben besteht.  Die heute bei uns gebräuchlichen Antiquaschriften sind eine Verbindung aus römischen Großbuchstaben und karolingischen Kleinbuchstaben. Die Großbuchstaben wurden nicht mehr nur als Initialen bei sondern auch zur Kenntlichmachung von Satz- bzw. Versanfängen und Namen genutzt. An der Logik der Groß- uns Kleinschreibung, die wir heute im Deutschen benutzen ist hauptsächlich Herr Duden schuld, der verbindliche Regeln aufstellte. "
Welche Stadt sieht man und stirbt dann? Und warum? Woher kommt diese Redewendung? Wer sprach sie aus?;"Es heißt ""Neapel sehen und sterben"". Der Spruch stammt aus dem italienischen (""vedi Napoli e poi muori"") allerdings ist die Übersetzung nicht so ganz korrekt. Im italienischen ist das Ganze ein Wortspiel mit dem Ortsnamen ""Muori"" einem kleinen Ort bei Neapel, den man erst nach Neapel sehen kann. ""Muori"" ist aber auch die italienische Verbform ""du stirbst"". Allerdings betrachten die Italiener Napoli auch als ""ein auf die Erde gefallenes Stück Himmel"". Während man in Deutschland und Frankreich bis ins 19. Jhd. die Stadt als SItz von Zauberei und Nekromatie ansah"
Welches Mittel wurde im Mai 1886 erstmals gegen Müdigkeit und Kopfschmerz eingesetzt?;John S. Pemperton entwickelte ein Tonikum, das in Soda aufgelöst wurde. Die heutige Coca-Cola
Wenn man im Winter durch den Gotthard-Tunnel fährt und das Fahrzeug eine Außentemperaturanzeige besitzt, stellt man fest, dass im Tunnel eine Temperatur von ca. 15°C herrscht, obwohl außerhalb Minusgrade sind. Weshalb ist`s im Tunnel so warm?;"Das ""Wärmewunder"" gibt es bei vielen Schweizer Tunneln. Der Grund ist, dass das in die Röhre einsickernde Wasser teilweise 20° warm ist. Ein riesiger Vorrat an Geothermalenergie, der an einigen Stellen auch ausgebeutet wird. Am Hauensteintunnel fließen pro Minute rund 2500 Liter Wasser mit einer Temperatur von 16-22 Grad aus dem Tunnel in die Aare. An einigen Tunnel werden Wärmepumpen betrieben, die nahegelegene Siedlungen mit Heizenergie versorgen."
Wer erfand eigentlich die Currywurst?;Wie es genau war, weiß wahrscheinlich keiner mehr. Fest aber steht, dass die Berlinerin Herta Heuwer die Erfindung beanspruchte und sich ihre Sauce bereits 1959 patentieren ließ. 200 Wurstbuden und 70 Millionen verzehrter Currywürste pro Jahr in Berlin sprechen für eine ausgebaute Tradition. 
Wer hat die Tasten auf der Tastatur so angeordnet, wie sie sind, und wieso hat er das getan?;Das heute übliche Tastaturlayout (QWERTZ bzw. QWERTY) datiert auf das Jahr 1868. Es geht die Mär, Christopher Latham Sholes hätte die Tastenanordnung so gewählt, dass man damit so langsam tippen musste, dass die damalige fusselige Mechanik nicht ständig hakte. Es gibt aber durchaus noch andere Tastaturbelegungssysteme, z.B. die Dvorak-Tastatur, bei der alle Vokale links, die wichtigsten Konsonanten rechts liegen. Diese Tastatur hat gegenüber der qwerty-Belegung wohl tatsächlich einige fundamentale Vorteile.
Wie bekommt z.B. Bonduelle die Erbsen aus den Schoten bevor die Erbsen in die Dosen wandern?;Hier die Antwort der Erasco: Wir lösen die Hülsenfrüchte nicht selber aus den Schoten aus, da wir Erbsen und andere Hülsenfrüchte meist in getrockneter Form beziehen. Der gesamte Vorgang ist dem der Getreideernte sehr ähnlich. Wenn die Hülsenfrüchte ausgereift sind, trocknet die Pflanze aus. Mit speziellen Erntemaschinen werden die Schoten von der trockenen Pflanze getrennt. Durch weitere mechanische Vorrichtungen an der Erntemaschine werden die Schoten aufgebrochen und die Erbsen, Bohnen etc. aus den Schoten gelöst. 
Wie brennt eine Kerze in Schwerelosigkeit?;Da es keinen Auftrieb gibt, steigt die erwärmte Luft auch nicht nach oben. Die Kerze verbrennt also mit einer kugelförmigen Flamme!
Wie entsteht Muskelkater? ;Da gibt's zwei Theorien  1. Wenn die Muskeln nicht mit genügend Sauerstoff versorgt werden, entsteht beim Stoffwechsel im Muskeln Milchsäure (Lactat). Die folgende Ansäuerung des Muskels tut den Muskelfasern nicht gut und das spürt man. 2. Beim < sog. Mikrotraumata, die genau wie andere Verletzungen wehtun.
Wie entsteht Schluckauf?;"Einen Schluckauf finden die meisten Menschen amüsant - nur nicht die Betroffenen. Denn meist kommt er zu den ungünstigsten Zeiten: bei einer geschäftlichen Besprechung, im Theater oder beim Essen. Ruckartig zieht sich der Bauch zusammen, und das Hicksen sorgt dafür, dass alle Bescheid wissen.  In den meisten Fällen sind sehr kalte oder heiße Speisen oder Getränke, zu reichliches oder hastiges Essen ebenso wie ein Übermaß an Alkohol Auslöser für Schluckauf. Begünstigt wird die von Ärzten ""Singultus"" genannte, meist zeitlich begrenzte Hickser-Attacke auch durch starke Nervosität oder organische Ursachen wie Magen- oder Bauchfellerkrankungen.  Schuld am Hicks ist das Zwerchfell. Es trennt den Brustkorb mit Lunge und Herz vom unteren Teil des Bauches, in dem Magen, Leber und Darm liegen. Das Zwerchfell ist aber nicht nur eine Trennwand, sondern gleichzeitig eine Muskelschicht. Beim Einatmen zieht sie sich zusammen und verschafft der Lunge, die sich mit Luft füllt, Platz. Gelangt etwas in den Magen, dass das Zwerchfell reizt, reagiert es mit ruckartigen Zuckungen: Die Muskelstränge ziehen sich beim Einatmen ganz plötzlich zusammen; die Luft strömt deutlich schneller ein. Etwa 35 Millisekunden nach der Schluckaufeinatmung schließt sich der Kehldeckel. Dabei entsteht auch das charakteristische Geräusch, das Hicksen. Die an der Ausatmung beteiligten Muskeln sind in dieser Zeit blockiert. Wozu ein Schluckauf gut sein soll, weiß keiner. Einige Wissenschaftler vermuten, dass er ein Überbleibsel der Atemübungen ungeborener Kinder ist. Ständig wiederkehrender oder andauernder Schluckauf kann die Lebensqualität erheblich beeinträchtigen. Laut dem ""Guinness Buch der Rekorde"" hickste ein Amerikaner in Los Angeles zwischen dem 13. Juni 1948 und dem 1. Juli 1956 gut 160 Millionen Mal hintereinander. Ist man organisch gesund, bekommt man den Hickser in kürzester Zeit in den Griff. Eine Reihe von Hausmitteln stehen zur Wahl: Ob Sie auf dem Kopf stehend ein Glas (Eis-)Wasser trinken, Zucker essen, die Luft anhalten, Essig schlucken, sich selbst auf die Augäpfel drücken, an ihrer Zunge ziehen oder versuchen, sich selbst zu erschrecken - das Prinzip ist dasselbe. Die ""Ablenkungsversuche"" reizen einen Teil des vegetativen Nervensystems, den Parasympathikus. Das melden die Nerven dann dem Atemzentrum im Gehirn, das den Hickser ausschaltet. Hoffentlich."
Wie erkältet man sich?;"Am besten gehst du im Winter mit nassen Haaren bei -8¡ Celsius raus, das klappt ziemlich sicher ;-) Tatsächlich hat es etwas mit deiner Immunabwehr und der Menge der in deinem Körper vorhandenen Erreger (zu tun. Normalerweise kann die körpereigene Abwehr locker die Menge der Viren etc. niederhalten, da bleibt das Immunsystem auch fit. Kommen jetzt mehr Erreger, oder neue Typen, packt das Immunsystem seine Arbeit nicht mehr... Schnupfen, Husten etc. sind die Folge. Stress und andere Faktoren (Kälte oder so) können den Körper aber so beanspruchen, dass die Immunabwehr geschwächt wird, dann langt evtl. auch die Normaldosis an Erreger. Gegen Viren helfen übrigens keine Antibiotika. "
Wie funktioniert eigentlich so eine Mikrowelle?;Durch die Mikrowellen wird im Inneren des Gerätes ein elektromagnetisces Feld aufgebaut, das mit ca. 2000 Megahertz schwingt. Diese Mikrowellen durchdringen die meisten Stoffe ohne absorbiert zu werden. Einige Materialien können aber diese Wellen gut absorbieren, und zwar alle Soffe, die polar aufgebaut sind. Sie verhalten sich praktisch wie kleine Magnete und wechseln in dem schwingenden Feld permanent ihre Ausrichtung durch diese heftige Molekülbewegung entsteht die Hitze. Gute Mikrowellenabsorber sind (in absteigender Reihenfolge) Wasser, Fette, Kohlenhydrate und Proteine. 
Wie heißen die Dinger, die man benutzt um die eigene Ware auf dem Supermarkt-Kassenfließband vom nächsten Kunden zu separieren? Man hört immer wieder diese Dinger seien die einzigen Alltagsgegenstände, für die es in der deutschen Sprache keine Bezeichnung gäbe.;"Es gibt eine: Zumindest im ALDI-internen Bestellwesen heißen die Dinger ""Kassentrennstäbe""."
Wie heisst der Fussballverein, der 1870 als der L and Y Railway Football Club gegründet wurde, heute? ;Der Lancashire and Yorkshire Railway Football Club (wurde allerdings 1878 gegründet) heißt heute Manchester United.
Wie hieß der schottische Entdeckungsreisende (1171-1806) der dem Niger bis ins Innere Afrikas folgte mit vollem Namen?;Das war wohl Mungo Park, er stellte damals fest, dass der Niger nach Osten fließt. 
Wie kam die Pizza Margherita zu ihrem Namen?;1889 musste Raffaele Esposito für den König Umberto I und seine Frau Margherita drei Pizzen backen. Eine Pizza hatte die Farben der italienischen Flagge: rot, weiß, grün (Tomate, Mozzarella, Basilikum). Diese Pizza schmeckte der Frau des Königs am besten und wurde nach ihr benannt.
Wie kann ich berechnen an welchem Sonntag im Jahre z.B. 2010 Ostern liegt? Irgendein Zusammenhang aus dem kirchlichen Gefeier muss doch vorhanden sein.;"Ostersonntag ist prinzipiell der Sonntag der dem ersten Vollmond nach der Frühlingsbeginn folgt (festgelegt beim Konzil von Nicäa 325). Alle anderen unregelmäßigen Feiertage eines Jahres können von diesem Tag abgeleitet werden: * Aschermittwoch ist 46 Tage vor Ostern * Pfingsten ist 49 Tage nach Ostern * Christi Himmelfahrt ist 10 Tage vor Pfingsten * Fronleichnam ist 11 Tage nach Pfingsten. Als Grundlage für die Osterberechnung soll ""der Meridian von Jerusalem, als dem Ort von Jesu Tod und Auferstehung"", benutzt werden. (So das Konzil von Nicäa). "
Wie kann man eine Dose Diät-Cola von einer normalen Cola unterscheiden, ohne sie zu öffnet oder das Etikett zu lesen?;Diät-Cola ist leichter
Wie kommt es zu einer Fata Morgana?;"Guckt man bei großer Hitze eine Straße entlang, sieht man es in einiger Entfernung flimmern, die Straße sieht nass aus. Morgana, die Fee aus der Artus-Saga, hat als Fabelwesen ihre Gestalt verändert und trügerische Bilder über Meer und Land ziehen lassen. Heute ist Morgana Namensgeberin für die Spiegelungen, hinter der ""nichts als heiße Luft steckt"", urteilt Gerhard Seifert vom Fachbereich Physik der Universität Halle-Wittenberg und liefert sogleich die wissenschaftliche Erklärung: ""Die Ursache dieses Phänomens ist tatsächlich die Erwärmung der Luftschicht direkt über dem Asphalt infolge der Sonneneinstrahlung."" Die heiße Luft am Boden dehnt sich aus, wird also ""dünner"", während etwas weiter oben die Luft kälter und damit ""dicker"" bleibt. Nun breitet sich Licht zwar im Vakuum geradlinig aus, sobald es aber Materie passiert, wird es von dieser abgelenkt und kann dabei auch ""um die Kurve"" laufen. Dabei spielt es im Prinzip keine Rolle, ob diese Materie fest (Glas), flüssig (Wasser) oder gasförmig (wie etwa Luft) ist. Ist der Asphalt heiß, beschreibt der Lichtstrahl, der im flachen Winkel auf die Straßenoberfläche trifft, auf seinem Weg durch die unterschiedlich ""dicke"" Luft einen Bogen, so dass der Strahl am Schluss wieder leicht schräg nach oben geleitet wird. Bei dieser Art von Reflexion, die zwischen Luftschichten mit unterschiedlichen Temperaturen entsteht, wirkt die untere Schicht wie ein Spiegel. Damit sieht man, je nach Augenhöhe, beispielsweise ein auf dem Kopf stehendes Bild von anderen Autos oder Straßenbäumen. Die Spiegelungen auf heißen Teerstraßen sind Fata Morganas im Miniformat. In der Wüste erreichen die Luftspiegelungen weit größere Dimensionen. Wenn die untere Luftschicht mehrere hundert Meter hoch liegt, können auch ganze Kamelherden oder Oasen an den Himmel gespiegelt werden. In den meisten Fällen aber wird einfach der Himmel gespiegelt - und erscheint wie eine große Wasserfläche. Der schwammige Eindruck der Luftspiegelungen entsteht dabei durch leichte Winde, welche die Spiegelung stören."
Wie können die den genetischen Code entschlüsselt haben, wenn der doch von Mensch zu Mensch unterschiedlich ist (sonst wären ja alle Menschen gleich und alle Katzen grau)?;"Die Ausprägung der genetisch festgelegten Eigenschaften ist bei allen Individuen unterschiedlich, nicht aber die Art der Codierung bzw. die Stellen, an denen die Informationen stehen. Vergleichbar mit einem Autokatalog. es hat ja nicht jedes Auto Servolenkung, auch wenn im Katalog eine Spalte dafür vorgesehen ist. Für das HUGO-Projekt wurde übrigens das Genom von 5 verschiedenen Menschen erforscht (drei Frauen, zwei Männer aus verschiedenen ethnischen Gruppen).  Warum wird bei den Länderspielen von England nicht Land of Hope and Glory gespielt, sondern God save the queen was ja eigentlich die Hymne von Großbritannien ist? Das Vereinigte Königreich von Großbritannien und Nordirland ist eine parlamentarische Demokratie, die in Personalunion die Staaten Großbritannien (England mit Wales (1536) und Schottland (1707) ) und Nordirland (1541) vereinigt.  Walisische Nationalhymne ""Hen Wlad Fy Nhadau"" Schottische ""Flower of Scotland"" "
Wie können Pferd und Esel gemeinsam Kleine kriegen, wenn ihre Chromosomenanzahl nicht übereinander stimmen?;Normalerweise würden die auch keine Jungen kriegen, weil die sich nicht paaren würden. Mulis und Maultiere sind vom Menschen initiierte Kreuzungen. Die Kinder sind aber immer unfruchtbar (wegen der Unterschiede)
Wie konnte Franz I, der ein Franzose war, sich zur deutschen Kaiserwahl stellen?;Großherzog Franz Stephan der 1745 zum deutschen Kaiser gewählt wurde hatte das Glück mit Österreichs Kaiserin Maria Theresia verheiratet zu sein. Preußen hat damals die Wahl anerkannt, gegen österreichische Bestätigung des eroberten schlesischen Besitzes. 
Wie schlafen Haie? Sie müssen doch immer in Bewegung sein, um die Kiemen mit sauerstoffhaltigem Wasser zu durchspülen, oder? ;"Das verhält sich beim Hai etwas anders. Er muss nicht schwimmen um zu atmen, sondern um nicht abzusacken. Haie haben keine Schwimmblase um den Auftrieb zu regulieren, sondern müssen das durch Kraftaufwendung erreichen (etwa wie beim Flugzeug, kein Motor an = kein Auftrieb.). Zum Schlafen legen sich Haie auf den Meeresgrund. ""Normale"" Fische dümpeln irgendwo im Wasser rum, wenn sie schlafen. "
Wie viele Brüste (weiblich) gibt es in Liechtenstein?;Liechtenstein hat 32057 Einwohner (Juli 1999)  Die unter 15 Jahren lassen wir weg (3076 Knaben 2949 Mädels), dann bleiben uns 13339 Frauen und 12693 Männer übrig. Mutationen, Operationen etc mal ignoriert, ergibt das 26678 weibliche Brüste. 
Wieso erscheint der Mond der Erde manchmal so nah, sprich uns riesengroß? Ist er manchmal näher dran oder hat das was mit der Atmosphäre zu tun?;"Zum weitaus größten Teil (über 95%) ist das Phänomen, dass einem der (Voll-) Mond nahe dem Horizont besonders groß erscheint, darauf zurückzuführen, dass er sich dort in der Regel nahe von bekannten Bezugsgrößen befindet, beispielsweise Bäumen oder Häusern. Ist - hoch am Himmel - kein direkter Größenvergleich möglich, erscheint er uns deutlich kleiner. Dann trägt auch die elliptische Umlaufbahn des Mondes dazu bei. Der Abstand des Mondes zur Erde schwankt dadurch um etwa 10% seiner Durchschnittsentfernung, und der Mond kann dann mal 30000 km näher an der Erde sein als ""normal"". Schließlich gibt es noch Lichtbrechungsereignisse, die einen ganz dicht über dem Horizont stehenden Mond ein kleines bisschen vergrößern können - er sieht dadurch auch ein wenig elliptisch aus. Wenn man ihn so sieht, ist er eigentlich schon untergegangen, nur durch Lichtbrechungen haben wir den Eindruck, er steht noch knapp über dem Horizont. Aber das macht weniger als 1% des beobachteten Phänomens aus. Alle diese Phänomene führen auch bei der Sonne dazu, dass sie uns tagsüber am Himmel eher klein, abends und morgens aber deutlich größer erscheint."
Wieso heißt die ZDF-Sendung ausgerechnet „Aktenzeichen XY ungelöst“?;Früher wurden alle ungelösten Fälle unter dem Buchstaben „U“ für ungelöst abgelegt. Es gab aber zu viele gelöste Fälle, die auch unter U abgelegt wurden. Um wieder Übersicht zu schaffen, wurden sie unter dem Buchstaben „XY“ abgelegt.
Wieviel Strom produziert ein Kernkraftwerk am Tag?;"Beispiel ""Biblis“: das AKW Biblis hat eine installierte Leistung von 1200 MW (relativ typischer Wert). Da AKW´s sehr unwirtschaftlich zu regeln sind, laufen Sie im Grundlastbetrieb, d. h. sie arbeiten ständig mit gleicher Leistung. Bei 24 h am Tag erhält man also 24 h * 1200 MW = 28,8 Mio kWh (zum Vergleich: der typische Privathaushalt verbraucht ca. 4000 kWh im Jahr (!), eine moderne Windkraftanlage erzeugt ca. 2 Mio kWh im Jahr). Die Jahreserzeugung eines AKW liegt bei rd. 9 Mrd. kWh, das entspricht einer Nutzungsdauer von ca. 7500 Stunden (nicht 8760, weil die Dinger eben ab und an gewartet/repariert werden). "
